name,url,author,description,homepage,num_watch,num_stars,num_forks,num_open_issues,last_updated,last_push
awesome-browser-extensions-for-github,https://github.com/stefanbuck/awesome-browser-extensions-for-github,stefanbuck,A collection of awesome browser extensions for GitHub.,https://stefanbuck.com/awesome-browser-extensions-for-github,87,2058,191,0,2021-02-10T20:22:02Z,2021-02-10T20:21:59Z
awesome-browserify,https://github.com/browserify/awesome-browserify,browserify,":crystal_ball: A curated list of awesome Browserify resources, libraries, and tools.",,9,80,7,0,2021-02-01T10:42:29Z,2017-01-04T23:45:44Z
awesome-btcdev,https://github.com/btcbrdev/awesome-btcdev,btcbrdev,List of resources of bitcoin development,,30,45,8,0,2020-11-16T14:19:44Z,2015-04-16T20:32:21Z
awesome-bugs,https://github.com/criswell/awesome-bugs,criswell,An opinionated list of truly awesome bugs,,1,1,0,0,2020-12-04T02:03:32Z,2020-06-17T18:32:43Z
awesome-building-blocks-for-web-apps,https://github.com/componently-com/awesome-building-blocks-for-web-apps,componently-com,Standalone features to be integrated into web applications,,6,36,2,1,2021-01-19T02:05:01Z,2020-09-26T22:54:33Z
awesome-c,https://github.com/aleksandar-todorovic/awesome-c,inputsh,Continuing the development of awesome-c list on GitHub,,182,2341,289,11,2021-02-09T12:40:45Z,2020-10-19T22:54:25Z
awesome-c,https://github.com/kozross/awesome-c,oz123,"A curated list of awesome C frameworks, libraries, resources and other shiny things. Inspired by all the other awesome-... projects out there.",,236,4356,508,18,2021-02-10T20:22:14Z,2021-02-03T04:59:46Z
awesome-cakephp,https://github.com/FriendsOfCake/awesome-cakephp,FriendsOfCake,"A curated list of amazingly awesome CakePHP plugins, resources and shiny things. ",,130,826,231,3,2021-02-10T13:23:06Z,2021-01-28T20:13:53Z
awesome-calculators,https://github.com/xxczaki/awesome-calculators,xxczaki,😎 A curated list of resources related to calculators!,,6,63,15,4,2020-12-28T16:00:13Z,2021-02-03T19:10:55Z
awesome-canvas,https://github.com/raphamorim/awesome-canvas,raphamorim,"A curated list of awesome HTML5 Canvas with examples, related articles and posts.",,49,943,117,6,2021-02-10T17:40:49Z,2020-12-26T00:08:03Z
awesome-captcha,https://github.com/ZYSzys/awesome-captcha,ZYSzys,:key: Curated list of awesome captcha libraries and crack tools.,http://zyszys.github.io/awesome-captcha/,26,558,73,2,2021-02-08T23:00:12Z,2020-12-12T01:00:00Z
awesome-cassandra,https://github.com/yikebocai/awesome-cassandra,yikebocai,awesome cassandra resources,,1,37,37,1,2020-04-15T23:26:29Z,2016-05-16T02:10:41Z
awesome_challenge_list,https://github.com/AwesomeRubyist/awesome_challenge_list,AwesomeRubyist,A list of sites with challenges to improve your programming skills,,5,23,11,1,2020-12-04T02:03:36Z,2018-03-30T10:13:04Z
awesome-challenges,https://github.com/mauriciovieira/awesome-challenges,mauriciovieira,A curated list of algorithmic challenges websites.,,8,89,7,3,2020-12-19T01:46:41Z,2021-01-17T08:57:52Z
awesome-charting,https://github.com/zingchart/awesome-charting,zingchart,"A curated list of the best charting and dataviz resources that developers may find useful, including the best JavaScript charting libraries",,46,1528,94,5,2021-02-09T19:16:10Z,2020-12-23T17:24:27Z
awesome-chatops,https://github.com/exAspArk/awesome-chatops,exAspArk,:robot: A collection of awesome things about ChatOps – managing operations through a chat,,35,635,79,1,2021-02-10T11:42:02Z,2020-10-16T08:30:44Z
awesome-chef,https://github.com/obazoud/awesome-chef,obazoud,A curated list of amazingly awesome Chef resources,,19,135,35,1,2021-02-01T08:16:52Z,2016-04-13T20:43:45Z
awesome-cheminformatics,https://github.com/hsiaoyi0504/awesome-cheminformatics,hsiaoyi0504,A curated list of Cheminformatics libraries and software.,,30,234,48,20,2021-02-06T17:29:00Z,2020-12-26T21:45:59Z
awesome-chess,https://github.com/hkirat/awesome-chess,hkirat,Chess!,,6,203,27,9,2021-02-07T07:01:37Z,2020-11-20T11:48:24Z
awesome-choo,https://github.com/choojs/awesome-choo,choojs,🌅 Awesome things related with choo framework,,7,194,24,2,2020-08-07T13:14:57Z,2019-12-19T10:14:54Z
awesome-chrome-devtools,https://github.com/ChromeDevTools/awesome-chrome-devtools,ChromeDevTools,Awesome tooling and resources in the Chrome DevTools & DevTools Protocol ecosystem,https://github.com/ChromeDevTools/awesome-chrome-devtools#readme,168,4512,282,7,2021-02-10T07:37:59Z,2021-01-30T11:45:28Z
awesome-ci,https://github.com/ligurio/awesome-ci,ligurio,List of Continuous Integration services,https://ligurio.github.io/awesome-ci/,112,2406,206,0,2021-02-09T19:10:30Z,2020-12-08T13:35:32Z
awesome-ci,https://github.com/pditommaso/awesome-ci,pditommaso,A curated list of awesome continuous integration services,,3,26,3,0,2020-09-25T19:09:16Z,2019-01-16T10:00:03Z
awesome-ciandcd,https://github.com/cicdops/awesome-ciandcd,cicdops,continuous integration and continuous delivery,http://www.cicdops.com,84,1233,134,9,2021-02-10T11:14:13Z,2021-01-12T19:54:54Z
awesome-circuitpython,https://github.com/adafruit/awesome-circuitpython,adafruit,"A curated list of awesome CircuitPython guides, videos, libraries, frameworks, software and resources.",https://www.circuitpython.org,61,351,35,3,2021-02-10T04:56:15Z,2021-01-29T19:33:50Z
awesome-cl,https://github.com/CodyReichert/awesome-cl,CodyReichert,"A curated list of awesome Common Lisp frameworks, libraries and other shiny stuff.",https://awesome-cl.com,93,1472,130,22,2021-02-10T20:34:42Z,2021-02-10T16:12:40Z
awesome-cl-software,https://github.com/azzamsa/awesome-cl-software,azzamsa,List of awesome application software built with Common Lisp,,17,156,8,0,2021-01-30T13:51:29Z,2020-11-10T04:48:51Z
awesome-cli-apps,https://github.com/agarrharr/awesome-cli-apps,agarrharr,🖥 📊 🕹 🛠 A curated list of command line apps,,246,7060,567,19,2021-02-10T18:41:26Z,2020-12-30T15:35:00Z
awesome-clojure,https://github.com/mbuczko/awesome-clojure,mbuczko,list of useful links for clojurians,,20,274,16,0,2021-02-06T14:51:45Z,2020-07-19T20:10:15Z
awesome-clojure,https://github.com/razum2um/awesome-clojure,razum2um,A curated list of awesome Clojure libraries and resources. Inspired by awesome-... stuff,,115,2067,172,9,2021-02-10T13:32:55Z,2021-01-31T23:43:17Z
awesome-clojurescript,https://github.com/hantuzun/awesome-clojurescript,hantuzun,"A community driven list of ClojureScript frameworks, libraries and wrappers.",,47,838,53,6,2021-02-06T14:57:34Z,2020-03-10T01:43:39Z
awesome-cloud,https://github.com/JStumpp/awesome-cloud,JStumpp,A curated list of delightful cloud services.,,10,85,28,1,2021-02-07T23:19:17Z,2014-07-13T14:59:17Z
awesome-cmake,https://github.com/onqtam/awesome-cmake,onqtam,"A curated list of awesome CMake resources, scripts, modules and examples.",,193,3471,361,0,2021-02-10T09:11:59Z,2020-10-13T12:40:19Z
awesome-cms,https://github.com/postlight/awesome-cms,postlight,📚 A collection of open and closed source Content Management Systems (CMS) for your perusal.,https://postlight.com/labs/awesome-cms,103,2342,247,3,2021-02-09T18:17:11Z,2021-01-26T13:45:16Z
Awesome-CobaltStrike-Defence,https://github.com/MichaelKoczwara/Awesome-CobaltStrike-Defence,MichaelKoczwara,Defences against Cobalt Strike,,24,394,53,1,2021-02-10T18:01:41Z,2021-01-11T10:35:06Z
awesome-cobol,https://github.com/mickaelandrieu/awesome-cobol,mickaelandrieu,"A curated list of awesome Cobol frameworks, libraries and software. Inspired by awesome-python.",,7,58,20,0,2021-01-25T06:39:21Z,2020-05-28T01:56:51Z
awesome-cocoa,https://github.com/v-braun/awesome-cocoa,v-braun,"A curated list of awesome Cocoa controls for iOS, watchOS and macOS",http://cocoa.rocks,4,42,7,0,2021-02-01T08:12:56Z,2020-04-24T16:43:45Z
awesome-code-formatters,https://github.com/rishirdua/awesome-code-formatters,rishirdua,A curated list of awesome code formatting tools and libraries,,8,118,17,5,2021-01-30T16:42:41Z,2020-10-17T15:54:04Z
awesome-code-review,https://github.com/joho/awesome-code-review,joho,"An ""Awesome"" list of code review resources - articles, papers, tools, etc",,88,2576,206,15,2021-02-10T21:41:29Z,2020-11-26T13:15:09Z
awesome-codepoints,https://github.com/Codepoints/awesome-codepoints,Codepoints,Awesome Code Points,,32,692,20,3,2021-02-06T11:24:34Z,2020-12-17T06:50:36Z
awesome-coins,https://github.com/Zheaoli/awesome-coins,Zheaoli,₿ A guide (for humans!) to cryto-currencies and their algos.,https://coinbin.org/,151,3237,249,9,2021-02-10T10:52:40Z,2020-10-05T16:18:27Z
awesome-cold-showers,https://github.com/hwayne/awesome-cold-showers,hwayne,For when people get too hyped up about things,,198,4462,52,10,2021-02-10T04:30:02Z,2020-08-06T17:04:32Z
awesome-coldfusion,https://github.com/seancoyne/awesome-coldfusion,seancoyne,"A curated list of awesome ColdFusion frameworks, libraries and software.",,16,79,30,4,2021-01-29T17:32:05Z,2019-10-02T11:24:09Z
awesome-common-lisp-learning,https://github.com/GustavBertram/awesome-common-lisp-learning,GustavBertram,A curated list of awesome Common Lisp learning resources,,5,92,7,1,2021-02-04T19:15:30Z,2020-12-29T02:42:22Z
awesome-community,https://github.com/phpearth/awesome-community,phpearth,"A curated list of awesome programming, development, technical support and discussion channels, groups, communities, resources and other shiny things",,18,190,43,0,2021-02-09T05:13:09Z,2020-04-10T19:32:18Z
awesome-community-detection,https://github.com/benedekrozemberczki/awesome-community-detection,benedekrozemberczki,A curated list of community detection research papers with implementations. ,,109,1588,273,0,2021-02-09T05:13:16Z,2021-01-24T20:52:44Z
awesome-comparisons,https://github.com/dhamaniasad/awesome-comparisons,dhamaniasad,A list of awesome comparison projects,,3,9,2,3,2021-02-08T17:54:32Z,2018-03-13T09:47:06Z
awesome-competitive-programming,https://github.com/lnishan/awesome-competitive-programming,lnishan,":gem: A curated list of awesome Competitive Programming, Algorithm and Data Structure resources",http://codeforces.com/blog/entry/23054,417,7495,1969,18,2021-02-10T14:34:40Z,2020-11-01T09:07:59Z
awesome-composer,https://github.com/jakoch/awesome-composer,jakoch," :sunglasses: A curated awesome list for Composer, Packagist, Satis, Plugins, Scripts, Composer related resources, tutorials.",,42,732,56,0,2021-02-02T16:52:39Z,2020-11-18T22:06:00Z
awesome-computational-neuroscience,https://github.com/eselkin/awesome-computational-neuroscience,eselkin,A list of schools and researchers in computational neuroscience,,21,217,34,5,2021-02-10T19:42:30Z,2020-08-23T01:15:40Z
awesome-computer-history,https://github.com/watson/awesome-computer-history,watson,"An Awesome List of computer history videos, documentaries and related folklore",,75,1931,130,13,2021-02-10T08:40:53Z,2020-10-01T23:34:52Z
awesome-computer-vision,https://github.com/AGV-IIT-KGP/awesome-computer-vision,AGV-IIT-KGP,A curated list of resources for Computer Vision,,32,33,17,3,2021-02-10T16:23:36Z,2016-08-14T03:21:17Z
awesome-computer-vision,https://github.com/jbhuang0604/awesome-computer-vision,jbhuang0604,A curated list of awesome computer vision resources,,1145,13804,3411,45,2021-02-10T23:54:11Z,2021-02-05T02:34:54Z
awesome-computer-vision-models,https://github.com/nerox8664/awesome-computer-vision-models,nerox8664,"A list of popular deep learning models related to classification, segmentation and detection problems",https://nerox8664.github.io/cls,22,259,56,0,2021-02-02T16:25:17Z,2021-02-02T16:25:14Z
awesome-conference-playlists,https://github.com/chentsulin/awesome-conference-playlists,chentsulin,video playlist collection for awesome conferences,,2,7,2,0,2019-08-21T19:14:40Z,2015-02-11T07:16:11Z
awesome-conferences,https://github.com/RichardLitt/awesome-conferences,RichardLitt,DEPRECATED :ticket: A list of awesome conferences,,57,719,118,5,2021-01-11T23:27:54Z,2018-10-27T08:28:51Z
awesome-connectivity-info,https://github.com/stevesong/awesome-connectivity-info,stevesong,Awesome list of connectivity indexes and reports to help you better under who has access to communication infrastructure and on what terms.,,12,56,8,0,2021-02-07T22:29:57Z,2020-12-15T17:17:21Z
awesome-conservation-tech,https://github.com/anselmbradford/awesome-conservation-tech,anselmbradford,An awesome list of tech and orgs helping to understand and conserve our natural resources,,3,12,2,0,2020-09-08T20:08:14Z,2016-02-09T05:34:17Z
awesome-construct,https://github.com/WebCreationClub/awesome-construct,WebCreationClub,"A curated list of tools, tutorials, examples, and much more, for the awesome game development engines Construct 2 and Construct 3",,7,35,10,0,2021-01-05T16:59:32Z,2020-04-07T17:07:57Z
awesome-container,https://github.com/tcnksm/awesome-container,tcnksm,A curated list of awesome container technologies and services,,10,147,23,8,2021-01-31T23:15:56Z,2020-08-05T01:15:48Z
awesome-conversational,https://github.com/mortenjust/awesome-conversational,mortenjust,,,21,169,15,1,2021-02-09T02:03:29Z,2017-09-18T17:26:53Z
awesome-cordova,https://github.com/busterc/awesome-cordova,busterc,":iphone: A curated list of amazingly awesome Cordova libraries, resources and shiny things.",,28,269,37,0,2021-01-25T20:21:23Z,2019-10-25T21:18:18Z
Awesome-CoreML-Models,https://github.com/likedan/Awesome-CoreML-Models,likedan,Largest list of models for Core ML (for iOS 11+),,241,4890,398,2,2021-02-10T12:22:18Z,2020-10-22T01:53:20Z
awesome-coronavirus,https://github.com/soroushchehresa/awesome-coronavirus,soroushchehresa,🦠  Huge collection of useful projects and resources for COVID-19 (2019 novel Coronavirus),https://corona.js.org,54,1366,372,0,2021-02-10T21:35:52Z,2021-02-10T21:35:48Z
awesome-couchdb,https://github.com/quangv/awesome-couchdb,quangv,CouchDB - curated meta resources & best practices list,,8,124,11,0,2021-01-07T18:29:12Z,2020-06-07T19:21:37Z
awesome-courses,https://github.com/fffaraz/awesome-courses,fffaraz,List of free online programming/CS courses [Massive Open Online Courses],,22,270,74,4,2021-02-03T15:35:09Z,2019-10-26T22:00:20Z
awesome-courses,https://github.com/prakhar1989/awesome-courses,prakhar1989,:books: List of awesome university courses for learning Computer Science!,,2381,36330,7180,49,2021-02-10T17:38:50Z,2021-01-26T11:12:18Z
awesome-cpp,https://github.com/fffaraz/awesome-cpp,fffaraz,"A curated list of awesome C++ (or C) frameworks, libraries, resources, and shiny things. Inspired by awesome-... stuff.",http://fffaraz.github.io/awesome-cpp/,2047,29836,5150,377,2021-02-10T22:21:55Z,2021-02-10T17:12:55Z
awesome-crdt,https://github.com/alangibson/awesome-crdt,alangibson,A collection of awesome CRDT resources,,31,492,29,2,2021-02-08T18:48:01Z,2020-11-06T11:56:55Z
awesome-creative-coding,https://github.com/terkelg/awesome-creative-coding,terkelg,"Creative Coding: Generative Art, Data visualization, Interaction Design, Resources.",,383,7440,584,13,2021-02-10T15:20:30Z,2021-02-04T15:53:57Z
Awesome-Cross-Platform-Apps,https://github.com/Juude/Awesome-Cross-Platform-Apps,Juude,the awesome list of cross platform apps solutions(跨平台app方案合集),,14,140,31,1,2021-01-29T17:00:34Z,2018-06-13T23:09:50Z
awesome-cross-platform-nodejs,https://github.com/bcoe/awesome-cross-platform-nodejs,bcoe,:two_men_holding_hands: A curated list of awesome developer tools for writing cross-platform Node.js code,,31,913,57,3,2021-02-03T22:13:07Z,2020-09-11T17:41:39Z
awesome-crypto-papers,https://github.com/pFarb/awesome-crypto-papers,pFarb,"A curated list of cryptography papers, articles, tutorials and howtos.",,62,957,90,0,2021-02-10T14:30:02Z,2020-11-22T22:58:07Z
awesome-cryptocurrencies,https://github.com/kasketis/awesome-cryptocurrencies,kasketis,A curated list of awesome cryptocurrencies 🎩,,11,124,19,2,2021-01-25T03:03:40Z,2018-11-24T00:51:18Z
awesome-cryptography,https://github.com/sobolevn/awesome-cryptography,sobolevn,A curated list of cryptography resources and links.,,158,2916,407,14,2021-02-10T21:28:58Z,2021-02-10T11:18:12Z
awesome-crystal,https://github.com/veelenga/awesome-crystal,veelenga,":gem: A collection of awesome Crystal libraries, tools, frameworks and software",http://awesomelists.top/#/repos/veelenga/awesome-crystal,118,2660,277,0,2021-02-08T14:39:57Z,2021-02-01T18:53:39Z
awesome-css,https://github.com/awesome-css-group/awesome-css,awesome-css-group,:art: A curated contents of amazing CSS :),,115,2942,313,0,2021-02-10T21:43:08Z,2020-12-27T12:04:03Z
awesome-css,https://github.com/bring2dip/awesome-css,bring2dip,A curated list of awesome CSS resources. Inspired by sindresorhus/awesome,,2,8,1,0,2020-11-27T13:13:01Z,2019-10-04T09:31:07Z
awesome-css-frameworks,https://github.com/troxler/awesome-css-frameworks,troxler,List of awesome CSS frameworks,,126,3625,254,5,2021-02-10T21:41:49Z,2021-01-15T01:29:30Z
awesome-css-learning,https://github.com/micromata/awesome-css-learning,micromata,A tiny list limited to the best CSS Learning Resources,,37,979,67,2,2021-02-09T12:46:44Z,2020-10-22T06:06:16Z
AwesomeCSV,https://github.com/secretGeek/awesomeCSV,secretGeek,🕶️A curated list of awesome tools for dealing with CSV.,,18,294,30,7,2021-02-08T19:21:07Z,2021-01-27T02:57:54Z
awesome-ctf,https://github.com/apsdehal/awesome-ctf,apsdehal,"A curated list of CTF frameworks, libraries, resources and softwares",https://apsdehal.in/awesome-ctf/,252,5442,1094,23,2021-02-10T18:18:45Z,2020-12-21T19:33:53Z
awesome-cybersecurity-blueteam,https://github.com/fabacab/awesome-cybersecurity-blueteam,fabacab,":computer:🛡️ A curated collection of awesome resources, tools, and other shiny things for cybersecurity blue teams.",,100,1420,307,0,2021-02-10T15:30:51Z,2021-02-06T13:32:24Z
awesome-cyclejs,https://github.com/cyclejs-community/awesome-cyclejs,cyclejs-community,A curated list of awesome Cycle.js resources,http://cycle.js.org,47,819,75,1,2021-02-10T00:42:31Z,2020-12-07T11:32:59Z
awesome-d,https://github.com/zhaopuming/awesome-d,dlang-community,"  A curated list of awesome D documents, frameworks, libraries and software. Inspired by awesome-python.",,34,468,63,12,2021-02-08T09:14:10Z,2020-11-24T23:25:32Z
awesome-d3,https://github.com/wbkd/awesome-d3,wbkd,"A list of D3 libraries, plugins and utilities",https://d3-discovery.net/,190,4577,288,6,2021-02-10T09:21:14Z,2020-10-22T13:45:32Z
awesome-dart,https://github.com/yissachar/awesome-dart,yissachar,"A curated list of awesome Dart frameworks, libraries, and software",,107,1520,158,13,2021-02-10T09:41:21Z,2020-12-18T04:55:32Z
awesome-dash,https://github.com/ucg8j/awesome-dash,ucg8j,A curated list of awesome Dash (plotly) resources,,47,1040,164,0,2021-02-10T08:12:07Z,2021-02-01T06:04:20Z
awesome-dashboard,https://github.com/obazoud/awesome-dashboard,obazoud,A curated list of amazingly awesome dashboards/visualization resources.,,58,791,91,4,2021-02-09T20:45:15Z,2020-05-05T07:44:25Z
awesome-data-engineering,https://github.com/igorbarinov/awesome-data-engineering,igorbarinov,A curated list of data engineering tools for software developers,,241,3351,655,35,2021-02-10T16:37:05Z,2021-01-13T19:55:24Z
awesome-datascience,https://github.com/academic/awesome-datascience,academic,:memo: An awesome Data Science repository to learn and apply for real world problems.,,1433,15304,4320,0,2021-02-10T22:57:08Z,2021-02-08T20:33:01Z
awesome-datasets,https://github.com/viisar/awesome-datasets,viisar,A curated list of awesome datasets for papers/experiments/validation.,,10,78,11,1,2021-02-03T09:16:06Z,2016-10-13T10:46:00Z
awesome-dataviz,https://github.com/fasouto/awesome-dataviz,fasouto,:chart_with_upwards_trend:  A curated list of awesome data visualization libraries and resources.,,153,2706,341,18,2021-02-10T15:36:12Z,2020-11-04T11:25:52Z
awesome-db,https://github.com/numetriclabz/awesome-db,numetriclabz,"A curated list of amazingly awesome database libraries, resources and shiny things by https://www.numetriclabz.com/",,59,848,123,27,2021-02-10T08:56:20Z,2021-01-21T10:55:01Z
awesome-ddd,https://github.com/heynickc/awesome-ddd,heynickc,"A curated list of Domain-Driven Design (DDD), Command Query Responsibility Segregation (CQRS), Event Sourcing, and Event Storming resources",,504,6851,886,2,2021-02-10T23:19:51Z,2021-02-08T13:26:43Z
awesome-ddd,https://github.com/wkjagt/awesome-ddd,wkjagt,A curated list of awesome Domain Driven Design resources inspired by Awesome PHP and Awesome Sysadmin.,,3,21,0,0,2021-02-09T01:35:28Z,2014-07-20T15:02:23Z
awesome-decentralized-web,https://github.com/gdamdam/awesome-decentralized-web,gdamdam,an awesome list of decentralized services and technologies,,82,1099,112,2,2021-02-10T09:47:28Z,2021-01-27T16:35:42Z
awesome-decision-tree-papers,https://github.com/benedekrozemberczki/awesome-decision-tree-papers,benedekrozemberczki,"A collection of research papers on decision, classification and regression trees with implementations.",,124,1699,275,0,2021-02-09T13:25:44Z,2021-01-24T20:53:07Z
awesome-deep-learning,https://github.com/ChristosChristofidis/awesome-deep-learning,ChristosChristofidis,"A curated list of awesome Deep Learning tutorials, projects and communities.",,1249,16618,5180,12,2021-02-10T23:53:59Z,2021-02-09T15:35:06Z
awesome-deep-learning-papers,https://github.com/terryum/awesome-deep-learning-papers,terryum,The most cited deep learning papers,,2013,22555,4361,35,2021-02-10T19:19:41Z,2020-08-27T13:43:48Z
Awesome-Deep-Learning-Resources,https://github.com/guillaume-chevalier/awesome-deep-learning-resources,guillaume-chevalier,"Rough list of my favorite deep learning resources, useful for revisiting topics or for reference. I have got through all of the content listed there, carefully. - Guillaume Chevalier",https://www.neuraxio.com/,123,1396,276,9,2021-02-06T05:50:30Z,2020-10-29T15:19:16Z
awesome-deep-rl,https://github.com/tigerneil/awesome-deep-rl,tigerneil,For deep RL and the future of AI. ,,99,960,183,0,2021-02-10T23:48:09Z,2020-09-17T17:17:33Z
awesome-deep-vision,https://github.com/kjw0612/awesome-deep-vision,kjw0612,A curated list of deep learning resources for computer vision ,,1129,9444,2709,39,2021-02-10T21:27:03Z,2021-02-04T14:05:08Z
awesome-deku,https://github.com/lambtron/awesome-deku,lambtron,A curated list of awesome Deku resources,,1,54,13,1,2018-10-19T06:01:06Z,2016-10-29T15:31:55Z
awesome-delphi,https://github.com/Fr0sT-Brutal/awesome-delphi,Fr0sT-Brutal,"Archived version of curated list of awesome Delphi frameworks, libraries, resources, and shiny things. Deprecated in favor of awesome-pascal",,16,76,25,0,2021-02-05T03:23:20Z,2019-02-04T15:05:34Z
awesome-deno,https://github.com/denolib/awesome-deno,denolib,Curated list of awesome things related to Deno,,87,2699,163,8,2021-02-10T18:01:37Z,2021-02-05T10:39:30Z
awesome-derby,https://github.com/russll/awesome-derby,russll,A collection of awesome derby components,,2,11,1,0,2018-02-20T08:52:45Z,2014-08-26T14:37:26Z
awesome-design,https://github.com/troyericg/awesome-design,troyericg,"An ever-growing/changing collection of tools, resources, tutorials, guidelines and examples. ",,5,65,3,1,2020-11-07T16:03:53Z,2014-12-02T17:49:22Z
awesome-design-patterns,https://github.com/DovAmir/awesome-design-patterns,DovAmir,A curated list of software and architecture related design patterns.,,476,11770,964,6,2021-02-10T16:23:17Z,2021-02-07T07:23:16Z
awesome-design-principles,https://github.com/robinstickel/awesome-design-principles,robinstickel,✨ A curated list of awesome design principles,,17,352,27,0,2021-02-09T01:48:09Z,2021-01-11T07:55:28Z
awesome-design-systems,https://github.com/alexpate/awesome-design-systems,alexpate,💅🏻 ⚒ A collection of awesome design systems,https://git.io/design-systems,460,12225,799,13,2021-02-10T20:10:30Z,2021-02-10T11:29:02Z
Awesome-Design-Tools,https://github.com/goabstract/Awesome-Design-Tools,goabstract,The best design tools and plugins for everything 👉,,489,21032,1591,20,2021-02-10T23:16:43Z,2021-01-13T17:07:32Z
awesome-desktop-js,https://github.com/styfle/awesome-desktop-js,styfle,🖥️ A list of awesome packages and frameworks for implementing javascript applications on the desktop,https://styfle.dev/projects/awesome-desktop-js,26,546,38,2,2021-02-06T11:16:05Z,2020-11-04T14:02:20Z
awesome-dev-fun,https://github.com/mislavcimpersak/awesome-dev-fun,mislavcimpersak,A curated list of awesome fun libs/packages/languages that have no real purpose but to make a developer chuckle.,,24,429,39,0,2021-02-10T11:41:42Z,2020-11-04T08:28:06Z
awesome-developer-blogs,https://github.com/endymion1818/awesome-developer-blogs,endymion1818,Are you a developer? Do you have a blog? Please submit a PR!,,7,51,18,3,2021-01-30T10:53:33Z,2021-01-30T10:53:31Z
awesome-devenv,https://github.com/jondot/awesome-devenv,jondot,"A curated list of awesome tools, resources and workflow tips making an awesome development environment.",,81,1966,154,13,2021-02-09T20:44:37Z,2021-01-25T08:37:37Z
awesome-devops,https://github.com/joubertredrat/awesome-devops,joubertredrat,This is my awesome list with all open source and free applications that you can use in your management,,39,576,74,56,2021-02-04T21:30:08Z,2019-10-12T20:10:53Z
awesome-devtools,https://github.com/moimikey/awesome-devtools,moimikey,"🤖 A curated list of in-browser bookmarklets, tools, and resources for modern full-stack software engineers.",,17,179,20,0,2021-02-07T07:57:08Z,2020-11-29T17:28:56Z
awesome-digital-nomads,https://github.com/cbovis/awesome-digital-nomads,cbovis,🏝 A curated list of awesome resources for Digital Nomads.,,48,589,41,3,2021-02-08T12:56:06Z,2021-01-27T02:07:19Z
awesome-digitalocean,https://github.com/jonleibowitz/awesome-digitalocean,jonleibowitz,A curated list of amazingly awesome DigitalOcean resources inspired by Awesome Sysadmin,,18,231,17,0,2021-02-09T04:52:50Z,2020-10-14T20:11:02Z
