name,url,author,description,homepage,num_watch,num_stars,num_forks,num_open_issues,last_updated,last_push
awesome-newsletters,https://github.com/zudochkin/awesome-newsletters,zudochkin,A list of amazing Newsletters,https://github.com/zudochkin/awesome-newsletters,73,2092,185,10,2021-02-09T12:41:23Z,2021-02-04T14:35:48Z
awesome-nextjs,https://github.com/unicodeveloper/awesome-nextjs,unicodeveloper,":notebook_with_decorative_cover: :books: A curated list of awesome resources : books, videos, articles about using Next.js (A minimalistic framework for universal server-rendered React applications) ",,150,5110,456,26,2021-02-10T19:37:29Z,2021-02-04T08:15:15Z
awesome-nim,https://github.com/VPashkov/awesome-nim,VPashkov,"A curated list of awesome Nim frameworks, libraries and software. Inspired by other awesome lists.",,42,583,37,9,2021-01-31T02:36:54Z,2019-11-14T12:10:15Z
awesome-nlp,https://github.com/keon/awesome-nlp,keon,:book: A curated list of resources dedicated to Natural Language Processing (NLP),,613,11545,2084,13,2021-02-10T23:53:30Z,2021-02-05T15:20:06Z
awesome-no-login-web-apps,https://github.com/aviaryan/awesome-no-login-web-apps,aviaryan,🚀 Awesome (free) web apps that work without login,,36,1286,164,25,2021-02-10T17:33:55Z,2021-01-21T07:02:42Z
awesome-nodejs,https://github.com/sindresorhus/awesome-nodejs,sindresorhus,:zap: Delightful Node.js packages and resources,https://node.cool,1712,39882,4851,8,2021-02-10T23:06:14Z,2021-01-30T04:57:12Z
awesome-non-financial-blockchain,https://github.com/machinomy/awesome-non-financial-blockchain,machinomy,Curated list of projects that build non-financial applications of blockchain,,39,491,73,0,2021-02-09T13:35:03Z,2020-10-12T09:05:29Z
awesome-nosql-guides,https://github.com/erictleung/awesome-nosql-guides,erictleung,:computer: Curated list of awesome resources and links about using NoSQL databases,https://erictleung.com/awesome-nosql-guides/,6,110,18,9,2021-01-25T05:41:50Z,2020-10-15T03:50:14Z
awesome-npm,https://github.com/sindresorhus/awesome-npm,sindresorhus,Awesome npm resources and tips,,121,3695,228,1,2021-02-10T05:01:48Z,2021-02-08T10:20:15Z
awesome-npm-scripts,https://github.com/RyanZim/awesome-npm-scripts,RyanZim,Everything awesome related to npm scripts and using npm as a build tool.,,28,586,37,2,2021-02-09T01:53:58Z,2020-06-03T08:36:44Z
awesome-ntnu,https://github.com/michaelmcmillan/awesome-ntnu,michaelmcmillan,A curated list of awesome projects by NTNU students.,,5,20,3,1,2020-05-11T15:44:48Z,2017-08-21T09:29:22Z
awesome-nuxt,https://github.com/nuxt-community/awesome-nuxt,nuxt-community,A curated list of awesome things related to Nuxt.js,,146,3727,480,42,2021-02-10T22:46:35Z,2021-02-05T18:33:46Z
awesome-objc-frameworks,https://github.com/follyxing/awesome-objc-frameworks,follyxing,【OC框架排名列表 】A curated list of awesome Objective-C frameworks,,25,329,115,0,2020-12-09T22:26:32Z,2016-09-28T07:26:10Z
awesome-observables,https://github.com/sindresorhus/awesome-observables,sindresorhus,Awesome Observable related stuff - An Observable is a collection that arrives over time.,,21,277,14,0,2021-01-23T08:08:51Z,2021-01-23T08:08:48Z
awesome-obsidian,https://github.com/kmaasrud/awesome-obsidian,kmaasrud,🕶️ Awesome stuff for Obsidian,,48,780,15,0,2021-02-10T02:57:53Z,2021-01-15T11:42:05Z
awesome-ocaml,https://github.com/ocaml-community/awesome-ocaml,ocaml-community,"A curated collection of awesome OCaml tools, frameworks, libraries and articles.",,122,2029,137,4,2021-02-10T06:10:21Z,2021-02-10T00:16:43Z
awesome-okr,https://github.com/domenicosolazzo/awesome-okr,domenicosolazzo,A curated list about OKR (Objective - Key Results),,60,1040,150,12,2021-02-09T03:01:02Z,2020-04-03T11:10:25Z
awesome-online-ide,https://github.com/styfle/awesome-online-ide,styfle,🌩️ A list of awesome online development environments,https://styfle.dev/projects/awesome-online-ide,86,2204,214,12,2021-02-09T12:41:13Z,2021-02-04T22:29:22Z
awesome-online-machine-learning,https://github.com/MaxHalford/awesome-online-machine-learning,MaxHalford,":bookmark_tabs: A curated list of online machine learning courses, software, and papers",,10,96,15,0,2021-02-05T23:44:28Z,2021-01-10T14:36:36Z
awesome-open-company,https://github.com/opencompany/awesome-open-company,opencompany,A community-curated list of awesome open companies.,,34,490,44,13,2021-02-08T17:12:39Z,2020-02-18T18:09:36Z
awesome-open-science,https://github.com/silky/awesome-open-science,silky,"some links to projects/tools related to ""open science"".",,15,122,14,0,2021-01-23T22:53:21Z,2017-10-31T20:45:51Z
awesome-open-source-supporters,https://github.com/zachflower/awesome-open-source-supporters,zachflower,⭐️ A curated list of companies that offer their services for free to Open Source projects,,10,449,60,3,2021-01-20T04:16:44Z,2021-01-06T14:14:28Z
awesome-opengl,https://github.com/eug/awesome-opengl,eug,"A curated list of awesome OpenGL libraries, debuggers and resources.",,95,1419,137,0,2021-02-10T15:18:43Z,2020-10-23T17:58:18Z
awesome-opensource-documents,https://github.com/44bits/awesome-opensource-documents,44bits,":blue_book: A curated list of awesome open source or open source licensed documents, guides, books.",,98,1619,152,7,2021-02-09T05:38:13Z,2020-05-30T11:14:20Z
awesome-OpenSourcePhotography,https://github.com/ibaaj/awesome-OpenSourcePhotography,ibaaj,A list of awesome free open source software & libraries for photography. Also tools for video.,,19,304,36,1,2021-02-10T05:21:35Z,2020-07-08T14:46:47Z
awesome-osc,https://github.com/amir-arad/awesome-osc,amir-arad,"A curated list of useful open-sound-control applications, libraries, resources and shiny things",,0,11,0,0,2021-01-25T04:39:05Z,2018-01-30T11:47:52Z
awesome-pascal,https://github.com/Fr0sT-Brutal/awesome-pascal,Fr0sT-Brutal,"A curated list of awesome Delphi/FreePascal/(any)Pascal frameworks, libraries, resources, and shiny things. Inspired by awesome-... stuff. Open source and freeware only!",,235,1044,230,5,2021-02-08T16:23:20Z,2021-01-08T20:22:13Z
awesome-pcaptools,https://github.com/caesar0301/awesome-pcaptools,caesar0301,A collection of tools developed by other researchers in the Computer Science area to process network traces. All the right reserved for the original authors.,http://caesar0301.github.io/awesome-pcaptools,184,2131,376,13,2021-02-10T08:46:14Z,2020-09-09T02:54:43Z
awesome-pentest,https://github.com/enaqx/awesome-pentest,enaqx,"A collection of awesome penetration testing resources, tools and other shiny things",,1088,13501,3467,14,2021-02-10T20:38:15Z,2021-02-06T13:34:40Z
awesome-pentest-cheat-sheets,https://github.com/coreb1t/awesome-pentest-cheat-sheets,coreb1t,Collection of the cheat sheets useful for pentesting,,164,2252,594,9,2021-02-09T03:35:47Z,2020-08-30T08:30:54Z
Awesome-People-in-Computer-Vision,https://github.com/solarlee/Awesome-People-in-Computer-Vision,solarlee,,,10,183,49,3,2021-02-07T13:36:54Z,2017-10-31T18:01:28Z
awesome-perfocards,https://github.com/Wolg/awesome-perfocards,Wolg,,,1,0,0,0,2015-03-17T12:38:13Z,2014-07-16T06:34:18Z
awesome-perl,https://github.com/hachiojipm/awesome-perl,hachiojipm,A curated list of awesome Perl frameworks and libraries. Come on Pull Requests!,,85,545,93,5,2021-02-08T06:20:36Z,2021-01-13T04:09:15Z
awesome-persian,https://github.com/fffaraz/awesome-persian,fffaraz,"A curated list of amazingly awesome Persian supporting tools, fonts, and development resources.",,19,163,29,4,2021-02-02T09:17:05Z,2020-07-02T04:18:38Z
awesome-phalcon,https://github.com/phalcon/awesome-phalcon,phalcon,A curated list of awesome Phalcon libraries and resources,,99,592,116,0,2021-01-30T11:48:56Z,2021-01-05T20:39:34Z
awesome-pharo,https://github.com/pharo-open-documentation/awesome-pharo,pharo-open-documentation," A collection of awesome Pharo libraries, tools, frameworks and software.",https://twitter.com/PharoOpen,18,155,15,9,2021-02-05T13:29:28Z,2021-01-25T11:09:45Z
awesome-pharo-ml,https://github.com/pharo-ai/awesome-pharo-ml,pharo-ai,"List of projects, books, booklets, papers, and applications related to machine learning, AI, data science in Pharo",,14,42,4,0,2020-12-20T10:56:50Z,2020-12-09T22:42:23Z
awesome-php,https://github.com/ziadoz/awesome-php,ziadoz,"A curated list of amazingly awesome PHP libraries, resources and shiny things.",,1849,24862,4783,103,2021-02-10T21:07:06Z,2021-02-10T03:30:20Z
awesome-PICO-8,https://github.com/pico-8/awesome-PICO-8,pico-8,"A curated list of awesome PICO-8 resources, carts, tools and more",https://pico-8.github.io/awesome-PICO-8/,111,1733,77,1,2021-02-07T14:52:35Z,2021-02-03T12:32:42Z
awesome-pinned-gists,https://github.com/matchai/awesome-pinned-gists,matchai,📌✨ A collection of awesome dynamic pinned gists for GitHub,,13,826,43,4,2021-02-10T23:05:40Z,2021-01-31T18:20:03Z
awesome-pipeline,https://github.com/pditommaso/awesome-pipeline,pditommaso,A curated list of awesome pipeline toolkits inspired by Awesome Sysadmin,,220,3730,429,12,2021-02-10T14:50:57Z,2021-02-03T20:24:35Z
awesome-piracy,https://github.com/Igglybuff/awesome-piracy,Igglybuff,A curated list of awesome warez and piracy links,,586,12050,1197,113,2021-02-10T23:59:46Z,2021-01-31T05:36:43Z
awesome-pixel-art,https://github.com/Siilwyn/awesome-pixel-art,Siilwyn,Curated list of everything awesome around pixel art.,,24,531,33,0,2021-02-02T20:55:42Z,2021-02-02T20:55:40Z
awesome-play1,https://github.com/PerfectCarl/awesome-play1,PerfectCarl,"A collection of modules, tools and resources for play1 ",,5,35,5,5,2020-12-14T16:31:20Z,2016-01-11T08:10:59Z
awesome-plotters,https://github.com/beardicus/awesome-plotters,beardicus,A curated list of code and resources for computer-controlled drawing machines and other visual art robots.,,43,480,36,2,2021-02-08T20:23:30Z,2021-01-27T16:31:51Z
awesome-podcasts,https://github.com/Ghosh/awesome-podcasts,ghosh,"🎙 Curated podcasts for designers, developers, product managers, entrepreneurs and hustlers",http://podcasts.surge.sh/,10,115,15,4,2021-01-30T21:26:43Z,2018-10-02T16:47:22Z
awesome-podcasts,https://github.com/rShetty/awesome-podcasts,rShetty,Collection of awesome podcasts,,271,10296,588,4,2021-02-09T18:57:09Z,2021-01-22T21:59:56Z
awesome-pokemon,https://github.com/tobiasbueschel/awesome-pokemon,tobiasbueschel,":video_game: A curated list of awesome Pokémon & Pokémon Go resources, tools and more.",,25,427,45,1,2021-02-02T02:55:10Z,2020-11-11T08:27:21Z
awesome-polymer,https://github.com/Granze/awesome-polymer,Granze,A collection of awesome Polymer resources.,,36,384,42,0,2020-12-18T22:34:43Z,2018-03-21T18:52:01Z
awesome-postcss,https://github.com/jdrgomes/awesome-postcss,jdrgomes,A curate list about PostCSS,,19,358,21,0,2021-02-02T18:14:58Z,2020-02-15T20:49:31Z
awesome-postgres,https://github.com/dhamaniasad/awesome-postgres,dhamaniasad,"A curated list of awesome PostgreSQL software, libraries, tools and resources, inspired by awesome-mysql",http://dhamaniasad.github.io/awesome-postgres,334,6786,565,42,2021-02-10T21:56:42Z,2021-02-02T14:27:56Z
awesome-power-mode,https://github.com/codeinthedark/awesome-power-mode,codeinthedark,Awesome Power Mode,,72,1048,95,11,2021-02-07T20:28:16Z,2020-07-23T02:41:43Z
awesome-powershell,https://github.com/janikvonrotz/awesome-powershell,janikvonrotz,A curated list of delightful PowerShell modules and resources,,185,2380,258,4,2021-02-10T19:53:33Z,2021-01-06T16:46:06Z
awesome-preact,https://github.com/preactjs/awesome-preact,preactjs,A curated list of amazingly awesome things regarding Preact ecosystem :star2:,,25,529,45,2,2021-02-10T13:49:14Z,2020-10-11T05:58:54Z
awesome-prisma,https://github.com/catalinmiron/awesome-prisma,catalinmiron,A collection of awesome things regarding Prisma ecosystem.,https://www.prisma.io/,15,303,26,9,2021-02-10T23:26:03Z,2021-01-30T09:19:32Z
awesome-product-design,https://github.com/teoga/awesome-product-design,matttga,"A collection of bookmarks, resources, articles for product designers.",,46,1556,114,6,2021-02-08T09:48:50Z,2020-10-27T01:05:43Z
awesome-product-management,https://github.com/dend/awesome-product-management,dend,A curated list of awesome resources for product/program managers to learn and grow.,,19,336,35,2,2021-02-09T04:47:41Z,2021-01-24T18:37:45Z
awesome-productivity,https://github.com/jyguyomarch/awesome-productivity,jyguyomarch,A curated list of delightful productivity resources.,,50,929,101,34,2021-02-09T12:47:08Z,2021-01-13T10:34:23Z
awesome-ProductManager,https://github.com/hugo53/awesome-ProductManager,hugo53,"A curated list of awesome book, tool and other resource for Product Managers. Inspired by 'awesome-' repos.",,20,218,27,1,2021-02-05T09:14:40Z,2018-04-17T19:03:17Z
awesome-programming-for-kids,https://github.com/HollyAdele/awesome-programming-for-kids,HollyAdele,A curated list of resources for teaching kids programming. ,,38,598,58,1,2021-02-06T21:29:51Z,2020-10-23T02:21:25Z
awesome-progressive-web-apps,https://github.com/TalAter/awesome-progressive-web-apps,TalAter,:sunrise: A collection of awesome resources for building progressive web apps,,58,1420,113,9,2021-01-30T17:38:04Z,2021-01-13T09:19:12Z
awesome-projects-boilerplates,https://github.com/melvin0008/awesome-projects-boilerplates,melvin0008,Boilerplates for mobile and web apps,,41,859,131,20,2021-02-10T05:20:52Z,2021-01-01T08:01:27Z
awesome-prolog,https://github.com/klaussinani/awesome-prolog,klaussinani,Curated list of Prolog packages and resources,,26,340,28,9,2021-02-08T02:37:44Z,2021-01-13T20:37:22Z
awesome-prometheus,https://github.com/roaldnefs/awesome-prometheus,roaldnefs,"A curated list of awesome Prometheus resources, projects and tools.",,44,846,105,0,2021-02-10T11:41:00Z,2021-02-09T21:37:26Z
awesome-prometheus-alerts,https://github.com/samber/awesome-prometheus-alerts,samber,🚨 Collection of Prometheus alerting rules,https://awesome-prometheus-alerts.grep.to,125,2209,380,16,2021-02-10T19:07:50Z,2021-02-07T19:48:10Z
awesome-promises,https://github.com/wbinnssmith/awesome-promises,wbinnssmith,A curated list of useful resources for JavaScript Promises,,38,1320,121,6,2021-02-06T16:16:51Z,2020-09-25T19:07:43Z
awesome-public-datasets,https://github.com/awesomedata/awesome-public-datasets,awesomedata,A topic-centric list of HQ open datasets.,https://awesomedataworld.slack.com,2230,43152,7645,108,2021-02-10T23:21:15Z,2021-01-30T05:11:14Z
awesome-puppet,https://github.com/rnelson0/awesome-puppet,rnelson0,A curated list of amazingly awesome puppet resources inspired by @bayandin's awesome-awesomeness.,,13,53,16,1,2020-12-12T11:29:27Z,2020-05-07T20:07:19Z
awesome-pure-css-no-javascript,https://github.com/Zhangjd/awesome-pure-css-no-javascript,Zhangjd,:scroll: A curated list of awesome pure CSS resources.,,10,233,34,1,2020-11-07T17:56:42Z,2016-04-30T09:27:05Z
awesome-purescript,https://github.com/passy/awesome-purescript,passy,"A curation of awesome PureScript libraries, resources and shiny things.",,23,369,16,0,2021-02-07T18:57:36Z,2019-10-30T15:59:26Z
awesome-pyramid,https://github.com/uralbash/awesome-pyramid,uralbash,"A curated list of awesome Pyramid apps, projects and resources.",,52,497,54,2,2021-02-10T19:18:28Z,2020-03-01T06:17:26Z
awesome-python,https://github.com/kevmo/awesome-python,kevmo,,,2,7,0,0,2020-12-29T14:33:30Z,2015-06-09T18:12:53Z
awesome-python,https://github.com/vinta/awesome-python,vinta,"A curated list of awesome Python frameworks, libraries, software and resources",https://awesome-python.com/,5536,93865,18396,131,2021-02-10T22:21:04Z,2021-02-10T16:08:15Z
awesome-python-cn,https://github.com/jobbole/awesome-python-cn,jobbole,Python资源大全中文版，包括：Web框架、网络爬虫、模板引擎、数据库、数据可视化、图片处理等，由「开源前哨」和「Python开发者」微信公号团队维护更新。,http://jobbole.github.io/awesome-python-cn/,2081,21524,6858,14,2021-02-10T16:11:33Z,2021-02-07T01:40:31Z
awesome-python-data-science,https://github.com/krzjoa/awesome-python-data-science,krzjoa,Probably the best curated list of data science software in Python.,https://krzjoa.github.io/awesome-python-data-science,42,780,141,3,2021-02-10T13:24:28Z,2021-01-01T17:18:04Z
awesome-python-in-education,https://github.com/quobit/awesome-python-in-education,quobit,A curated list about Python in Education :snake: :mortar_board:,,40,517,111,10,2021-02-10T05:58:45Z,2020-12-28T15:08:42Z
awesome-python-models,https://github.com/grundic/awesome-python-models,grundic,"A curated list of awesome Python libraries, which implement models, schemas, serializers/deserializers, ODM's/ORM's, Active Records or similar patterns.",,12,122,10,2,2021-01-29T19:04:03Z,2018-05-07T19:53:05Z
awesome-python-scientific-audio,https://github.com/faroit/awesome-python-scientific-audio,faroit, Curated list of python software and packages related to scientific research in audio,,76,996,137,30,2021-02-09T09:44:45Z,2020-12-29T10:03:21Z
awesome-python-talks,https://github.com/jhermann/awesome-python-talks,jhermann,":clapper: :mortar_board: An opinionated list of awesome videos related to Python, with a focus on training and gaining hands-on experience.",,35,450,40,1,2021-01-24T21:18:35Z,2018-12-06T12:58:20Z
awesome-python-typing,https://github.com/typeddjango/awesome-python-typing,typeddjango,"Collection of awesome Python types, stubs, plugins, and tools to work with them.",https://github.com/typeddjango,24,653,33,1,2021-02-10T04:30:27Z,2020-12-05T09:10:02Z
Awesome-pytorch-list,https://github.com/bharathgs/Awesome-pytorch-list,bharathgs,"A comprehensive list of pytorch related content on github,such as different models,implementations,helper libraries,tutorials etc.",,598,11491,2449,1,2021-02-10T16:17:09Z,2021-02-10T16:17:00Z
awesome-qa,https://github.com/seriousran/awesome-qa,seriousran,😎 A curated list of the Question Answering (QA),,37,587,97,0,2021-02-10T17:24:34Z,2021-01-14T01:05:04Z
awesome-qsharp,https://github.com/ebraminio/awesome-qsharp,ebraminio,A curated list of Q# code and resources.,,13,95,15,0,2021-02-08T11:13:36Z,2021-02-01T21:36:51Z
awesome-qt,https://github.com/JesseTG/awesome-qt,JesseTG,"A curated list of awesome tools, libraries, and resources for the Qt framework.",,75,765,115,8,2021-02-09T17:50:27Z,2020-12-11T14:45:32Z
awesome-qt,https://github.com/skhaz/awesome-qt,skhaz,"A curated list of awesome Qt libraries, resources, and shiny things. Inspired by awesome-... stuff.",,2,14,1,0,2020-07-08T08:56:58Z,2014-10-07T18:04:26Z
awesome-quantified-self,https://github.com/woop/awesome-quantified-self,woop,":bar_chart: Websites, Resources, Devices, Wearables, Applications, and Platforms for Self Tracking",,83,1220,111,7,2021-02-10T22:11:51Z,2021-02-06T21:08:43Z
awesome-quantum-computing,https://github.com/desireevl/awesome-quantum-computing,desireevl,A curated list of awesome quantum computing learning and developing resources.,,101,1301,235,0,2021-02-09T16:39:33Z,2021-02-05T04:35:16Z
awesome-R,https://github.com/qinwf/awesome-R,qinwf,"A curated list of awesome R packages, frameworks and software.",,411,4445,1386,3,2021-02-10T00:03:26Z,2021-02-04T16:54:55Z
awesome-radio,https://github.com/kyleterry/awesome-radio,kyleterry,Awesome radio stuff,,4,156,27,2,2021-01-13T08:14:21Z,2019-09-23T07:54:14Z
awesome-rails,https://github.com/dpaluy/awesome-rails,dpaluy,A curated list of amazingly awesome open source rails related resources inspired by Awesome PHP.,,7,91,15,1,2021-01-27T00:45:15Z,2021-01-11T16:51:09Z
awesome-rails,https://github.com/gramantin/awesome-rails,gramantin,A curated list of awesome things related to Ruby on Rails,https://gramantin.github.io/awesome-rails,152,2494,322,1,2021-02-10T18:42:31Z,2021-02-10T15:38:10Z
awesome-rails,https://github.com/ruby-vietnam/awesome-rails,ruby-vietnam,A collection of awesome Rails libraries/app examples/ebooks/tutorials/screencasts/magazines/news,,15,47,13,1,2020-12-28T03:13:51Z,2017-01-24T11:38:34Z
awesome-rails-gem,https://github.com/hothero/awesome-rails-gem,hothero,A collection of awesome Ruby Gems for Rails development.,,117,2712,290,30,2021-02-10T18:10:55Z,2020-10-16T18:28:52Z
awesome-random-forest,https://github.com/kjw0612/awesome-random-forest,kjw0612,Random Forest - a curated list of resources regarding random forest,http://jiwonkim.org/awesome-random-forest,123,977,324,5,2021-02-07T15:19:31Z,2019-08-23T01:20:01Z
awesome-raspberry-pi,https://github.com/blackout314/awesome-raspberry-pi,blackout314,curated list of projects with raspberry pi,http://blackout314.github.io/awesome-raspberry-pi/,22,304,36,0,2021-02-09T15:33:12Z,2019-12-23T16:34:53Z
awesome-raspberry-pi,https://github.com/thibmaek/awesome-raspberry-pi,thibmaek,"📝 A curated list of awesome Raspberry Pi tools, projects, images and resources",https://awesome-rpi.netlify.com,438,8164,782,2,2021-02-10T15:23:32Z,2021-01-27T18:36:46Z
awesome-react,https://github.com/enaqx/awesome-react,enaqx,A collection of awesome things regarding React ecosystem,,1526,41489,5030,97,2021-02-10T23:14:18Z,2021-02-09T20:21:41Z
awesome-react-components,https://github.com/brillout/awesome-react-components,brillout,Curated List of React Components & Libraries.,,707,25239,2097,1,2021-02-10T20:41:13Z,2021-02-04T06:05:25Z
awesome-react-hooks,https://github.com/glauberfc/awesome-react-hooks,glauberfc,A curated list about React Hooks,,26,929,67,9,2021-02-10T08:23:56Z,2020-06-24T03:28:04Z
awesome-react-native,https://github.com/jondot/awesome-react-native,jondot,"Awesome React Native components, news, tools, and learning material!",http://www.awesome-react-native.com,1137,29010,3598,80,2021-02-10T21:30:27Z,2021-01-19T11:18:36Z
awesome-react-state-management,https://github.com/olegrjumin/awesome-react-state-management,olegrjumin,⚛️    React state management tools and libraries,,5,67,11,1,2021-02-09T20:10:09Z,2021-01-16T19:59:26Z
awesome-react-state-management-tools,https://github.com/cs01/awesome-react-state-management-tools,cs01,list of react state management tools,,5,70,16,0,2021-01-20T08:05:26Z,2021-01-05T01:17:27Z
awesome-readme,https://github.com/matiassingers/awesome-readme,matiassingers,A curated list of awesome READMEs,,188,8806,2353,40,2021-02-10T23:31:30Z,2021-02-02T07:32:13Z
awesome-reasonml,https://github.com/vramana/awesome-reasonml,vramana,A collection of awesome things regarding Reason/OCaml ecosystem.,,65,1447,84,2,2021-01-30T23:40:38Z,2020-11-29T02:07:47Z
awesome-recommender-system,https://github.com/Geek4IT/awesome-recommender-system,Geek4IT,"A curated list of awesome frameworks, libraries and software about Recommender System.",,5,26,3,1,2020-12-04T02:24:50Z,2016-11-11T12:46:07Z
awesome-recursion-schemes,https://github.com/passy/awesome-recursion-schemes,passy,Resources for learning and using recursion schemes.,,40,934,53,2,2021-02-09T04:39:05Z,2020-11-27T07:37:02Z
awesome-redux,https://github.com/brillout/awesome-redux,brillout,Catalog of Redux Libraries & Learning Material,https://devarchy.com/redux,15,325,33,4,2021-02-10T20:17:29Z,2018-12-20T11:24:33Z
awesome-redux,https://github.com/xgrommx/awesome-redux,xgrommx,Awesome list of Redux examples and middlewares,,398,11842,1041,36,2021-02-10T23:49:17Z,2020-10-16T11:37:29Z
awesome-refinerycms,https://github.com/refinerycms-contrib/awesome-refinerycms,refinerycms-contrib,"A collection of awesome Refinery CMS extensions, resources and shiny things.",,2,25,3,0,2019-07-23T05:01:55Z,2016-04-07T14:18:53Z
awesome-regex,https://github.com/aloisdg/awesome-regex,aloisdg,"A curated collection of awesome Regex libraries, tools, frameworks and software",,48,953,124,18,2021-02-10T12:56:07Z,2021-02-07T21:04:29Z
awesome-regression-testing,https://github.com/mojoaxel/awesome-regression-testing,mojoaxel,🕶️ A curated list of resources around the topic: visual regression testing,,65,1372,119,3,2021-02-10T13:01:06Z,2020-11-10T07:48:17Z
awesome-relay,https://github.com/expede/awesome-relay,expede,Awesome resources for Relay,,17,245,31,3,2021-02-01T07:10:56Z,2018-10-30T20:29:41Z
awesome-remote-job,https://github.com/lukasz-madon/awesome-remote-job,lukasz-madon,A curated list of awesome remote jobs and resources. Inspired by https://github.com/vinta/awesome-python,,1005,19936,1966,3,2021-02-10T23:33:39Z,2021-02-06T13:50:22Z
awesome-RemoteWork,https://github.com/hugo53/awesome-RemoteWork,hugo53,"Resources for remote workers: approaches, hiring page, remote life and more.",,70,918,97,5,2021-02-09T01:10:48Z,2020-11-30T14:12:54Z
awesome-research,https://github.com/emptymalei/awesome-research,emptymalei,":seedling: a curated list of tools to help you with your research/life; I built a front end around this repo, please use the link",https://tools.kausalflow.com/tools,56,1124,171,1,2021-02-10T05:23:07Z,2020-10-09T19:57:17Z
awesome-rest,https://github.com/marmelab/awesome-rest,marmelab,"A collaborative list of great resources about RESTful API architecture, development, test, and performance",https://github.com/marmelab/awesome-rest,149,2683,348,14,2021-02-09T18:27:57Z,2021-02-02T20:48:27Z
awesome-rethinkdb,https://github.com/d3viant0ne/awesome-rethinkdb,d3viant0ne,"A curated list of awesome RethinkDB resources, libraries, tools and applications",,11,100,9,1,2020-12-22T13:53:09Z,2016-05-09T21:05:19Z
awesome-ripple,https://github.com/vhpoet/awesome-ripple,vhpoet,A curated list of Ripple resources,http://ripple.com,16,155,28,1,2021-02-03T21:39:04Z,2018-10-08T18:28:31Z
awesome-rl,https://github.com/aikorea/awesome-rl,aikorea,Reinforcement learning resources curated,http://aikorea.org/awesome-rl,470,6935,1618,17,2021-02-10T21:53:53Z,2020-11-08T13:27:55Z
awesome-rnn,https://github.com/kjw0612/awesome-rnn,kjw0612,Recurrent Neural Network - A curated list of resources dedicated to RNN,,636,5751,1432,4,2021-02-10T09:00:00Z,2020-10-18T05:39:29Z
awesome-roadmaps,https://github.com/liuchong/awesome-roadmaps,liuchong,A curated list of roadmaps.,,29,501,56,0,2021-02-10T20:39:42Z,2020-12-17T13:37:56Z
