name,url,author,description,homepage,num_watch,num_stars,num_forks,num_open_issues,last_updated,last_push
aksh,https://github.com/svaksha/aksh,svaksha,My personal bibliography of STEM resources and grey literature.,http://svaksha.github.io/aksh,3,29,3,0,2021-01-17T07:35:05Z,2017-07-01T07:10:58Z
amas,https://github.com/sindresorhus/amas,sindresorhus,Awesome & Marvelous Amas,,43,1269,218,0,2021-02-03T20:39:52Z,2021-01-24T07:15:05Z
Annual-Reading-List,https://github.com/davidskeck/Annual-Reading-List,davidskeck,A list of things to read every year.,,16,101,14,2,2021-02-09T13:54:11Z,2020-04-25T18:09:25Z
awesomebandnames,https://github.com/jnv/awesomebandnames,jnv,The open-source list of awesome band names. ,,3,4,5,0,2020-08-30T08:04:21Z,2019-06-08T07:47:02Z
awesome-belarus-online,https://github.com/Friz-zy/awesome-belarus-online,Friz-zy,list of useful belarusian online resources,,10,43,5,1,2020-11-03T07:30:28Z,2019-11-21T18:15:38Z
awesome-biology,https://github.com/raivivek/awesome-biology,raivivek,Curated (meta)list of resources for Biology.,,18,169,30,1,2021-02-06T17:29:18Z,2020-08-20T13:42:52Z
awesome-board-games,https://github.com/edm00se/awesome-board-games,edm00se,A curated list of awesome and exceptional board games. Please contribute!,https://awesomeboard.games,4,103,53,0,2021-02-02T14:36:30Z,2021-02-02T14:36:28Z
awesome-ethics,https://github.com/HussainAther/awesome-ethics,HussainAther,A curated list of awesome ethics,,2,12,2,0,2020-12-19T15:28:22Z,2019-04-17T22:51:47Z
awesome-fantasy,https://github.com/RichardLitt/awesome-fantasy,RichardLitt,:european_castle: Fantasy literature worth reading,,29,704,130,4,2021-02-10T05:15:59Z,2020-10-06T13:35:13Z
awesome-gif,https://github.com/Kikobeats/awesome-gif,Kikobeats,A curated list of awesome gif's resources.,,4,76,2,0,2021-01-21T14:58:58Z,2018-10-29T20:22:06Z
awesome-glasgow,https://github.com/allyjweir/awesome-glasgow,allyjweir,"Some highlights around Glasgow, Scotland",,0,3,0,0,2018-08-26T12:14:11Z,2014-09-03T22:57:16Z
awesome-hacking-locations,https://github.com/daviddias/awesome-hacking-locations,daviddias,":computer: :coffee: List of Awesome Hacking Locations, organised by Country and City, listing if it features power and wifi",,30,830,144,9,2021-02-06T11:16:00Z,2020-10-27T13:55:11Z
awesome-health,https://github.com/prabhic/awesome-health,prabhic,A curated list of health resources,,6,37,3,0,2020-12-22T21:08:46Z,2015-06-25T09:44:16Z
awesome-images,https://github.com/heyalexej/awesome-images,heyalexej,A curated list of amazingly awesome free (stock) photo resources inspired by all the other awesomes.,,117,2175,245,29,2021-02-04T02:36:59Z,2019-10-20T12:45:30Z
awesome-kimchi,https://github.com/jeyraof/awesome-kimchi,jeyraof,"Kimchi of the people, by the people, for the people, shall not perish from the earth",,2,42,3,0,2020-09-22T09:07:59Z,2014-10-28T06:28:27Z
awesome-lego,https://github.com/ad-si/awesome-lego,ad-si,Curated list of awesome LEGO resources,,13,121,13,2,2021-01-07T21:11:44Z,2020-10-05T09:12:05Z
awesome-lockpicking,https://github.com/fabacab/awesome-lockpicking,fabacab,":unlock::sunglasses: A curated list of awesome guides, tools, and other resources related to the security and compromise of locks, safes, and keys.",,32,634,76,0,2021-02-07T05:47:33Z,2021-01-27T03:44:12Z
awesome-maps,https://github.com/simsieg/awesome-maps,simsieg,There is more than google: A collection of great online maps 🌍🗺🌎,https://github.com/simsieg/awesome-maps,5,119,7,0,2021-02-08T02:09:02Z,2020-12-01T12:51:42Z
awesome-mental-health,https://github.com/dreamingechoes/awesome-mental-health,dreamingechoes,"A curated list of awesome articles, websites and resources about mental health in the software industry.",https://dreamingechoes.github.io/awesome-mental-health,52,1919,101,1,2021-02-10T15:22:13Z,2020-12-06T19:52:41Z
awesome-parasite,https://github.com/ecohealthalliance/awesome-parasite,ecohealthalliance,A curated list of host-parasite information,,4,13,2,8,2021-01-15T13:36:48Z,2021-01-15T13:36:46Z
awesome-philosophy,https://github.com/HussainAther/awesome-philosophy,HussainAther,A curated list of awesome philosophy,,5,56,3,0,2021-02-10T15:22:08Z,2019-10-26T02:46:47Z
awesome-scifi,https://github.com/sindresorhus/awesome-scifi,sindresorhus,Sci-Fi worth consuming,,119,2952,215,10,2021-02-10T15:50:14Z,2021-01-23T08:09:05Z
awesome-speaking,https://github.com/matteofigus/awesome-speaking,matteofigus,Resources about public speaking,,54,1081,94,1,2021-02-09T13:58:10Z,2020-10-05T14:39:51Z
awesome-stock-resources,https://github.com/neutraltone/awesome-stock-resources,neutraltone,":city_sunrise: A collection of links for free stock photography, video and Illustration websites",,285,9589,675,78,2021-02-10T23:41:51Z,2021-01-27T16:54:52Z
awesome-theravada,https://github.com/johnjago/awesome-theravada,johnjago,Curated list of Theravada Buddhist teachings,,11,88,12,0,2021-02-09T01:23:26Z,2019-12-08T18:27:04Z
awesome-uncopyright,https://github.com/johnjago/awesome-uncopyright,johnjago,Curated list of all things public domain,,11,287,20,1,2021-02-10T11:40:36Z,2020-10-10T03:24:08Z
awesome-webcomics,https://github.com/dhamaniasad/awesome-webcomics,dhamaniasad,A curated list of awesome webcomics,,4,34,5,1,2020-11-10T21:48:57Z,2017-11-07T16:03:36Z
baby-sleep,https://github.com/simple10/baby-sleep,simple10,Baby sleep guides curated from the best of the Internet.,,2,10,0,0,2020-05-08T13:43:45Z,2014-10-19T04:08:07Z
bailfunds.github.io,https://github.com/bailfunds/bailfunds.github.io,bailfunds,A collection of community resources for protestors around the country.,https://bailfunds.github.io/,4,71,28,11,2021-01-22T23:08:54Z,2020-11-03T18:21:28Z
boardgames,https://gitlab.com/gamearians/boardgames,gamearians,"#MovingToGitlab A list of popular/awesome boardgames (print and play, 3D print, ...) hosted on GitHub. ",https://gitlab.com/gamearians/boardgames,1,2,0,0,2018-10-16T20:07:18Z,2018-05-17T10:48:58Z
chinese-poetry,https://github.com/chinese-poetry/chinese-poetry,chinese-poetry,"The most comprehensive database of Chinese poetry 🧶最全中华古诗词数据库,  唐宋两朝近一万四千古诗人,  接近5.5万首唐诗加26万宋诗.  两宋时期1564位词人，21050首词。 🤪  😜 阿里招p6/p7 Python Golang | gaojunqi@outlook.com | 上海张江",http://shici.store,1052,31082,6417,56,2021-02-10T15:22:09Z,2021-01-29T01:43:07Z
cocktails,https://github.com/balevine/cocktails,balevine,Cocktail Recipes,,5,89,35,3,2021-02-01T12:40:58Z,2021-01-12T19:19:33Z
corporate-logos,https://github.com/marketreef/corporate-logos,marketreef,"Curated repo of publicly listed co. logos, identified by ticker.",,2,18,1,2,2020-10-15T06:44:07Z,2013-04-30T22:31:07Z
creative-commons-media,https://github.com/shime/creative-commons-media,shime,A curated list of resources that provide media licensed under Creative Commons licenses.,,25,348,23,3,2021-01-20T05:37:08Z,2020-10-05T20:46:34Z
dissertation-tips,https://github.com/katychuang/dissertation-tips,katychuang,a collection of resources to help PhD students complete their dissertation successfully,,2,27,2,0,2020-12-22T21:26:40Z,2016-12-06T04:33:23Z
diversity-index,https://github.com/svaksha/diversity-index,svaksha,"A curated Diversity-Index of grants, scholarships and FA that encourages diversity in STEM fields aimed at half the world's population, Women!",http://svaksha.github.io/diversity-index,9,56,14,0,2021-01-22T09:45:00Z,2016-04-06T08:05:44Z
diversity-twitter,https://github.com/gregorycoleman/diversity-twitter,gregorycoleman,,,1,3,1,1,2020-07-14T16:49:15Z,2017-01-11T02:26:14Z
food-recipes,https://github.com/obfuscurity/food-recipes,obfuscurity,"Honest-to-goodness ""real food"" recipes",,4,40,13,0,2020-12-26T14:07:12Z,2020-05-15T21:01:20Z
list-of-frequent-transit-maps,https://github.com/wwcline/list-of-frequent-transit-maps,wwcline,List of all frequent transit maps — http://humantransit.org/2010/08/basics-the-case-for-frequency-mapping.html,,2,1,0,1,2019-02-28T21:39:18Z,2019-02-28T21:39:17Z
global-reports,https://github.com/andressoop/global-reports,andressoop,List of major global reports published by international organisations.,,1,1,0,0,2021-01-15T15:09:44Z,2021-01-15T15:09:41Z
guitarspecs,https://github.com/gitfrage/guitarspecs,gitfrage,Overview of the electric guitar's parts specs,https://gitfrage.github.io/guitarspecs/,5,130,8,0,2021-02-04T16:32:08Z,2020-12-27T13:09:11Z
reading-list,https://github.com/isaacs/reading-list,isaacs,a list of books I recommend,,4,111,2,3,2021-01-13T19:48:23Z,2015-12-24T21:06:44Z
lawrence-veggie,https://github.com/codysoyland/lawrence-veggie,codysoyland,"List of vegetarian/vegan restaurants in Lawrence, KS",,2,9,0,0,2020-11-21T06:40:36Z,2010-05-09T04:31:51Z
lawyersongithub,https://github.com/dpp/lawyersongithub,dpp,A Telegram site for the people who are lawyers and also have GitHub accounts,,31,88,121,50,2020-12-29T01:13:21Z,2019-06-24T21:09:03Z
low-resource-languages,https://github.com/RichardLitt/low-resource-languages,RichardLitt,"Resources for conservation, development, and documentation of low resource (human) languages.",,31,244,50,1,2021-01-31T09:24:25Z,2020-12-01T14:45:37Z
Mind-Expanding-Books,https://github.com/hackerkid/Mind-Expanding-Books,hackerkid, :books: Books everyone should read!,https://books.vishnuks.com,172,6180,791,25,2021-02-10T21:25:20Z,2021-01-14T18:50:18Z
mining-resources,https://github.com/Mining-Resources/mining-resources,Mining-Resources,A curated list of mining resources from the web,mining-resources.github.io/mining-resources,4,7,0,0,2020-12-22T21:26:55Z,2018-07-19T00:56:24Z
no-free-basics,https://github.com/net-neutrality/no-free-basics,net-neutrality,"List of those who have spoken up against Facebook's ""Free Basics"" ",http://net-neutrality.github.io/no-free-basics/,1,10,2,0,2018-11-24T14:14:56Z,2016-01-20T03:53:58Z
plastic-free,https://github.com/IrosTheBeggar/plastic-free,IrosTheBeggar,,,1,2,0,0,2020-10-28T17:58:58Z,2020-10-28T17:58:56Z
ProjectSoundtracks,https://github.com/sarthology/ProjectSoundtracks,sarthology,🎧 List of best Soundtracks to boost your Productivity and Focus,,10,282,28,1,2021-01-21T20:51:53Z,2020-11-03T16:25:24Z
PublicMedia,https://github.com/melodykramer/PublicMedia,melodykramer,"Everything Public Media, in One Place",,18,35,35,6,2020-06-14T23:55:37Z,2015-07-28T12:47:45Z
recipes,https://github.com/bzimmerman/recipes,bzimmerman,,,3,8,13,1,2020-07-28T10:17:16Z,2015-08-17T13:59:23Z
recipes,https://github.com/csswizardry/recipes,csswizardry,Collection of things I like cooking,,2,39,6,1,2020-09-19T20:55:07Z,2014-07-19T15:17:13Z
recipes,https://github.com/LarryMad/recipes,LarryMad,,,8,70,21462,2275,2021-01-15T20:37:06Z,2021-02-10T16:10:30Z
recipes,https://github.com/nofunsir/recipes,nofunsir,My Recipes. Enjoy!,,0,0,0,0,2017-02-20T03:34:21Z,2017-02-20T06:27:17Z
recipes,https://github.com/schacon/recipes,schacon,,,3,14,32,0,2019-06-10T11:31:29Z,2011-08-18T18:50:48Z
recipes,https://github.com/silizuo/recipes,silizuo,recipes of silizuo,,2,2,0,0,2020-01-22T13:46:00Z,2016-01-20T13:12:04Z
sf-vegetarian-restaurants,https://github.com/mojombo/sf-vegetarian-restaurants,mojombo,A list of awesome vegetarian-friendly restaurants in SF,,4,142,34,0,2021-01-13T19:28:37Z,2011-07-13T23:52:48Z
shelfies,https://github.com/kyro/shelfies,kyro,Bookshelves of awesome people,,8,42,5,2,2020-12-04T01:33:45Z,2017-07-26T02:47:17Z
SiliconValleyThingsToDo,https://github.com/cjbarber/SiliconValleyThingsToDo,cjbarber,Things to do and activities within Silicon Valley.,,6,194,5,0,2020-12-24T19:42:23Z,2014-11-14T17:59:55Z
stayinghomeclub,https://github.com/phildini/stayinghomeclub,phildini,A list of all the companies WFH or events changed because of covid-19,https://stayinghome.club,16,476,1115,44,2021-01-20T20:42:09Z,2021-01-14T10:59:31Z
Sustainable-Earth,https://github.com/bizz84/Sustainable-Earth,bizz84,A curated list of all things sustainable,,12,158,31,18,2021-01-29T17:49:25Z,2020-10-03T07:51:25Z
tacofancy,https://github.com/sinker/tacofancy,sinker,community-driven taco repo. stars stars stars.,,89,1225,457,13,2021-02-09T00:26:38Z,2020-09-24T22:59:03Z
teesites,https://github.com/elder-cb/teesites,elder-cb,A public list of great sites to buy awesome t-shirts and other cool stuff.,,6,40,13,0,2020-06-12T16:43:58Z,2019-10-02T08:56:52Z
101,https://github.com/ojas/101,ojas,Resources on building a software biz,,3,84,7,0,2021-02-03T07:04:28Z,2015-08-06T17:53:32Z
10PL,https://github.com/nuprl/10PL,nuprl,"10 papers that all PhD students in programming languages ought to know, for some value of 10",,57,740,25,1,2021-01-22T22:34:45Z,2019-11-12T16:10:22Z
1on1-questions,https://github.com/VGraupera/1on1-questions,VGraupera,Mega list of 1 on 1 meeting questions compiled from a variety to sources,,155,8321,533,5,2021-02-10T14:18:29Z,2020-10-01T14:59:02Z
30-seconds-of-code,https://github.com/30-seconds/30-seconds-of-code,30-seconds,Short JavaScript code snippets for all your development needs,https://www.30secondsofcode.org/js/p/1,2003,68286,7534,6,2021-02-10T21:44:09Z,2021-02-10T18:39:52Z
30-seconds-of-interviews,https://github.com/30-seconds/30-seconds-of-interviews,30-seconds,A curated collection of common interview questions to help you prepare for your next interview.,https://30secondsofinterviews.org,200,8606,737,14,2021-02-10T23:34:17Z,2021-01-28T05:55:35Z
a11yproject.com,https://github.com/a11yproject/a11yproject.com,a11yproject,The A11Y Project is a community-driven effort to make digital accessibility easier.,https://a11yproject.com,224,3285,490,37,2021-02-10T22:43:55Z,2021-02-10T22:43:54Z
addinslist,https://github.com/daattali/addinslist,daattali,📜 Discover and install useful RStudio addins ,,52,614,114,0,2021-02-07T20:31:36Z,2021-01-28T22:07:40Z
admesh-projects,https://github.com/admesh/admesh-projects,admesh,List of projects using ADMesh,,2,1,0,0,2016-01-25T17:11:07Z,2016-01-25T17:11:06Z
AI-reading-list,https://github.com/m0nologuer/AI-reading-list,m0nologuer,Up to date list of the most interesting papers in AI,,14,126,26,1,2020-12-29T13:33:34Z,2015-11-30T11:51:55Z
alexandria,https://github.com/alxgcrz/alexandria,alxgcrz,Toolbox for my daily work,,3,23,9,0,2021-02-10T22:38:51Z,2021-02-10T22:38:48Z
algovis,https://github.com/enjalot/algovis,enjalot,collection of projects and links about algorithm visualization,,81,1223,104,7,2021-02-10T17:09:14Z,2019-10-14T20:38:46Z
alternative-internet,https://github.com/redecentralize/alternative-internet,redecentralize,A collection of interesting new networks and tech aiming at decentralisation (in some form).,,323,4175,424,17,2021-02-10T10:50:32Z,2021-01-19T08:57:07Z
amazing-deployment,https://github.com/delirehberi/amazing-deployment,delirehberi,"A curated list of amazing Deployment libraries, library distributions, scripts, tools and resources.",,8,97,9,0,2021-01-31T03:48:11Z,2020-03-29T01:39:01Z
android-awesome-libraries,https://github.com/kaiinui/android-awesome-libraries,kaiinui,There are many libraries which helps your android development!,,5,107,21,1,2020-12-19T08:02:50Z,2016-02-15T04:07:28Z
android-dev-readme,https://github.com/anirudh24seven/android-dev-readme,anirudh24seven,Collection of links for every Android developer,,35,448,57,0,2020-12-20T10:40:08Z,2015-05-01T10:12:33Z
AndroidDevTools,https://github.com/inferjay/AndroidDevTools,inferjay,收集整理Android开发所需的Android SDK、开发中用到的工具、Android开发教程、Android设计规范，免费的设计素材等。,https://www.androiddevtools.cn,686,7021,2079,5,2021-02-09T09:38:58Z,2021-01-21T05:32:30Z
android-jobs,https://github.com/android-cn/android-jobs,android-cn,2018 年最新内推！我们相信来到这里的，无论工程师还是招聘者都是靠谱的！微信公众号:codekk，,https://p.codekk.com,560,2250,692,23,2021-01-26T15:18:13Z,2020-07-21T03:50:16Z
Android-Learning-Resources,https://github.com/zhujun2730/Android-Learning-Resources,zhujun2730,Android学习资源网站索引大全,,96,1363,358,2,2021-02-06T20:07:26Z,2019-09-29T02:34:06Z
android-open-project,https://github.com/Trinea/android-open-project,Trinea,"A categorized collection of Android Open Source Projects,  More powerful web version:",https://p.codekk.com/,3745,30456,12149,27,2021-02-10T06:59:45Z,2020-10-17T08:16:20Z
android-security-awesome,https://github.com/ashishb/android-security-awesome,ashishb,A collection of android security related resources,,403,5127,1198,1,2021-02-10T20:59:56Z,2021-02-08T05:27:16Z
android-tech-frontier,https://github.com/hehonghui/android-tech-frontier,hehonghui,【停止维护】一个定期翻译国外Android优质的技术、开源库、软件架构设计、测试等文章的开源项目,https://blog.csdn.net/bboyfeiyu,1158,10290,3398,11,2021-02-09T01:30:19Z,2021-02-05T06:48:31Z
angular-education,https://github.com/timjacobi/angular-education,timjacobi,A list of helpful material to develop using Angular,,480,5454,937,4,2021-02-10T23:02:39Z,2021-02-09T20:22:13Z
AngularJS-Learning,https://github.com/jmcunningham/AngularJS-Learning,jmcunningham,"A bunch of links to blog posts, articles, videos, etc for learning AngularJS",,901,10873,2159,9,2021-02-09T18:31:00Z,2019-03-25T01:49:15Z
ansible-gentoo-roles,https://github.com/jirutka/ansible-gentoo-roles,jirutka,A curated list of Ansible roles for Gentoo Linux.,,1,9,3,0,2020-12-26T19:46:35Z,2016-03-02T20:30:29Z
apis-list,https://github.com/apis-list/apis-list,apis-list,"Community maintained, human and machine readable list of Public APIs. Join!  🌍 📒",,2,7,0,2,2021-02-10T15:38:02Z,2021-02-05T08:18:24Z
app-ideas,https://github.com/florinpop17/app-ideas,florinpop17,A Collection of application ideas which can be used to improve your coding skills.,,1721,36650,5134,165,2021-02-10T23:06:16Z,2021-02-09T17:04:45Z
app-launch-guide,https://github.com/adamwulf/app-launch-guide,adamwulf,"This aims to be an indie dev's definitive guide to building and launching your app, including pre-launch, marketing, building, QA, buzz building, and launch. More info at:",http://www.applaunchguide.com,182,3832,229,8,2021-02-10T23:19:57Z,2019-07-28T14:25:59Z
applied-ml,https://github.com/eugeneyan/applied-ml,eugeneyan,📚 Papers & tech blogs by companies sharing their work on data science & machine learning in production.,,492,7539,873,0,2021-02-10T20:54:13Z,2021-02-06T23:13:18Z
APTnotes,https://github.com/kbandla/APTnotes,kbandla,"Various public documents, whitepapers and articles about APT campaigns",,640,2808,820,6,2021-02-10T20:13:28Z,2019-09-18T04:11:33Z
architect-awesome,https://github.com/xingshaocheng/architect-awesome,xingshaocheng,后端架构师技术图谱,,3352,51762,16029,56,2021-02-10T15:43:29Z,2020-12-24T15:08:09Z
asynchronous-php,https://github.com/elazar/asynchronous-php,elazar,List of resources for asynchronous programming in PHP,,81,956,65,1,2021-02-08T08:09:10Z,2021-01-26T12:47:25Z
Automated-SPA-Testing,https://github.com/webpro/Automated-SPA-Testing,webpro,Automated unit & functional testing for web applications,,6,108,12,0,2019-11-05T19:42:06Z,2017-06-15T22:20:59Z
awful-ai,https://github.com/daviddao/awful-ai,daviddao,😈Awful AI is a curated list to track current scary usages of AI - hoping to raise awareness,https://twitter.com/dwddao,275,5500,184,22,2021-02-10T21:32:55Z,2021-01-04T13:19:11Z
awmy,https://github.com/potch/awmy,potch,,,1,4,12,5,2020-12-22T02:50:34Z,2020-04-11T08:20:06Z
Backpack,https://github.com/sevab/Backpack,sevab,Collection of useful dev links,,2,18,4,0,2020-09-27T12:25:09Z,2018-07-31T12:23:24Z
badass-dev-resources,https://github.com/sodevious/badass-dev-resources,sodevious,"Some #bada55 front-end developer resources, curated and loved by @sodevious",,1,8,0,2,2020-12-09T15:24:43Z,2014-10-03T19:55:00Z
bangalore-startups,https://github.com/hemanth/bangalore-startups,hemanth,Ever growing list of startups in Bangalore.,,5,25,9,0,2020-10-16T15:31:32Z,2017-08-12T16:33:52Z
beautiful-docs,https://github.com/PharkMillups/beautiful-docs,PharkMillups,"Pointers to useful, well-written, and otherwise beautiful documentation.",,194,4800,334,26,2021-02-09T18:56:24Z,2020-11-12T02:26:51Z
BEM-resources,https://github.com/sturobson/BEM-resources,sturobson,Just a repo full of BEM resources,,23,446,22,1,2021-02-09T21:23:06Z,2019-06-26T08:35:06Z
Best-App,https://github.com/hzlzh/Best-App,hzlzh,收集&推荐优秀的 Apps/硬件/技巧/周边等,,1319,14736,1794,35,2021-02-10T22:18:23Z,2020-05-15T09:55:09Z
best-of-awesomeness-and-usefulness-for-webdev,https://github.com/Pestov/best-of-awesomeness-and-usefulness-for-webdev,Pestov,The best of awesomeness and usefulness for web developers for year,http://ipestov.com/,35,345,32,3,2020-09-30T08:04:56Z,2018-01-06T17:31:03Z
best-practices-checklist,https://github.com/palash25/best-practices-checklist,palash25,"A list of awesome idiomatic code resources. Rust:crab:, Go, Ruby:gem:, Pony :horse:, Ocaml :camel:, Erlang and more",https://twitter.com/palash2504/status/1180570821351366656,33,773,75,1,2021-02-10T23:13:30Z,2020-12-08T07:21:19Z
Best-websites-a-programmer-should-visit,https://github.com/sdmg15/Best-websites-a-programmer-should-visit,sdmg15,:link: Some useful websites for programmers.,,1220,34931,4547,298,2021-02-10T20:40:29Z,2021-01-27T22:05:14Z
bigdata-ecosystem,https://github.com/zenkay/bigdata-ecosystem,zenkay,BigData Ecosystem Dataset,http://bigdata.andreamostosi.name/,102,551,179,0,2021-02-01T17:27:07Z,2017-11-19T16:31:57Z
Big-List-of-ActivityPub,https://github.com/shleeable/Big-List-of-ActivityPub,shleeable,Big List of ActivityPub Projects,,5,61,5,2,2021-02-03T16:33:58Z,2020-12-18T22:24:53Z
big-list-of-naughty-strings,https://github.com/minimaxir/big-list-of-naughty-strings,minimaxir,The Big List of Naughty Strings is a list of strings which have a high probability of causing issues when used as user-input data.,,873,39367,1786,74,2021-02-10T20:26:22Z,2021-02-08T21:41:16Z
bioinformatics-compbio-tools,https://github.com/lancelafontaine/bioinformatics-compbio-tools,lancelafontaine,"A curated list of useful bioinformatics and computational biology tools, sorted by category.",,2,36,4,0,2020-01-09T08:22:49Z,2015-04-29T23:36:03Z
bitcoin-reading-list,https://github.com/jashmenn/bitcoin-reading-list,jashmenn,a reading list for learning to program Bitcoin transactions,,124,858,211,5,2021-01-31T04:25:38Z,2020-02-02T14:30:38Z
BNN-ANN-papers,https://github.com/takyamamoto/BNN-ANN-papers,takyamamoto,Papers : Biological and Artificial Neural Networks,,8,50,3,0,2020-12-07T14:00:17Z,2020-04-22T14:24:36Z
bookmarklets,https://github.com/RadLikeWhoa/bookmarklets,RadLikeWhoa,"bookmarklets is a curated list of, you guessed it, bookmarklets that are useful on the web.",https://sacha.me/bookmarklets,4,64,7,0,2021-02-10T13:58:01Z,2015-06-01T07:13:41Z
bookshelf,https://github.com/OpenTechSchool/bookshelf,OpenTechSchool,📚  Reading lists for learners,,16,85,32,8,2021-02-09T13:54:06Z,2017-10-11T09:51:00Z
bots,https://github.com/hackerkid/bots,hackerkid, :zap: Tools for building bots,,71,947,167,5,2021-02-09T12:47:04Z,2021-01-08T20:20:58Z
breakfast-repo,https://github.com/ashleygwilliams/breakfast-repo,ashleygwilliams,"a collection of videos, recordings, and podcasts to accompany our morning coffee",,56,371,10,71,2020-11-07T11:33:13Z,2016-06-23T12:38:23Z
browser-resources,https://github.com/azu/browser-resources,azu,A Collection of official Resources/Status/Issues for browsers.,,18,113,4,0,2020-11-07T14:24:56Z,2020-04-01T07:02:44Z
build-your-own-x,https://github.com/danistefanovic/build-your-own-x,danistefanovic,🤓 Build your own (insert technology here),https://twitter.com/danistefanovic,3640,97956,8601,163,2021-02-10T23:46:23Z,2021-02-07T22:04:43Z
channels,https://github.com/andrew--r/channels,andrew--r,📺 A collection of useful YouTube channels for javascript developers and web designers,,304,3898,429,1,2021-02-08T22:47:29Z,2021-01-03T16:52:02Z
citizen-science,https://github.com/dylanrees/citizen-science,dylanrees,"🔬 A repository of resources related to citizen, community-based and/or non-institutional science",,15,120,14,4,2020-12-28T05:49:41Z,2020-07-15T18:45:47Z
classics,https://github.com/eyy/classics,eyy,"🏛 Classical studies (Latin and Ancient Greek) resources: software, code and raw data",,1,9,0,0,2019-11-13T21:39:53Z,2016-05-11T16:45:19Z
cloud-conferences,https://github.com/stefan-kolb/cloud-conferences,stefan-kolb,A collection of scientific and industry conferences focused on cloud computing.,http://stefan-kolb.github.io/cloud-conferences/,5,19,20,3,2021-01-25T13:46:58Z,2021-01-25T13:46:56Z
code-canon,https://github.com/darius/code-canon,darius,A catalog of code worth reading,,4,73,4,1,2021-02-07T23:11:44Z,2017-05-25T17:22:16Z
codeface,https://github.com/chrissimpkins/codeface,chrissimpkins,Typefaces for source code beautification,,187,5406,409,22,2021-02-10T20:58:00Z,2020-09-19T17:07:57Z
Colorful,https://github.com/Siddharth11/Colorful,Siddharth11,A curated list of awesome resources to choose your next color scheme,,12,688,39,0,2021-02-08T22:57:36Z,2020-11-22T19:37:08Z
CompilerJobs,https://github.com/mgaudet/CompilerJobs,mgaudet,"A listing of compiler, language and runtime teams for people looking for jobs in this area",https://mgaudet.github.io/CompilerJobs/,10,166,20,9,2021-01-27T18:54:40Z,2021-01-27T18:54:26Z
compilers-targeting-c,https://github.com/dbohdan/compilers-targeting-c,dbohdan,A list of compilers that can generate C code,,29,377,26,2,2021-02-08T21:44:51Z,2020-12-03T10:21:44Z
computer-science,https://github.com/ossu/computer-science,ossu,:mortar_board: Path to a free self-taught education in Computer Science!,,4170,74863,10809,13,2021-02-10T22:57:57Z,2021-02-08T21:36:42Z
content-management-systems,https://github.com/ahadb/content-management-systems,ahadb,A wide range of content management systems,,1,18,4,1,2021-01-12T06:53:26Z,2014-08-06T07:04:58Z
