name,url,author,description,homepage,num_watch,num_stars,num_forks,num_open_issues,last_updated,last_push
learn-python,https://github.com/adrianmoisey/learn-python,adrianmoisey,List of resources useful for learning Python 🐍,,8,193,37,0,2021-02-04T03:31:22Z,2020-10-31T11:21:37Z
learn-python,https://github.com/trekhleb/learn-python,trekhleb,📚 Playground and cheatsheet for learning Python. Collection of Python scripts that are split by topics and contain code examples with explanations.,,564,6775,1174,3,2021-02-10T15:16:17Z,2021-01-22T13:38:53Z
learn-to-program,https://github.com/karlhorky/learn-to-program,karlhorky,Educational resources to learn to program (Foundation in Web Development),,51,869,130,16,2021-02-10T21:25:52Z,2020-10-15T05:45:20Z
learn-tt,https://github.com/jozefg/learn-tt,jozefg,A collection of resources for learning type theory and type theory adjacent fields.,,88,1424,79,4,2021-02-08T04:19:39Z,2020-08-12T12:36:10Z
learnxinyminutes-docs,https://github.com/adambard/learnxinyminutes-docs,adambard,Code documentation written as code! How novel and totally my idea!,https://learnxinyminutes.com/,264,8704,2644,172,2021-02-10T23:45:31Z,2021-02-09T06:09:01Z
libertr,https://github.com/gaapt/libertr,gaapt,Resources for liberty seekers,http://libertr.github.io/libertr/,3,8,2,0,2021-02-09T05:25:58Z,2015-12-21T02:25:41Z
lifeofjs,https://github.com/abhijeetkpawar/lifeofjs,web-stack,A collection of resources on JavaScript in a programmaticaly manageable JSON format,http://lifeofjs.com,8,36,14,1,2020-10-05T15:46:32Z,2018-11-08T09:42:20Z
Linux_websites,https://github.com/hduffddybz/Linux_websites,hduffddybz,Commonly used kernel hacking site,,15,62,12,1,2020-11-30T06:47:04Z,2015-12-06T06:34:30Z
machine-learning-algorithms,https://github.com/Sahith02/machine-learning-algorithms,Sahith02,A curated list of almost all machine learning algorithms and deep learning algorithms grouped by category.,https://github.com/Sahith02/machine-learning-algorithms,8,86,21,0,2021-01-11T15:19:51Z,2020-06-26T10:19:15Z
Machine-Learning-Tutorials,https://github.com/ujjwalkarn/Machine-Learning-Tutorials,ujjwalkarn,"machine learning and deep learning tutorials, articles and other resources ",http://ujjwalkarn.github.io/Machine-Learning-Tutorials,801,11040,3344,23,2021-02-10T21:54:23Z,2020-12-19T08:07:38Z
machine-learning-with-ruby,https://github.com/arbox/machine-learning-with-ruby,arbox,Curated list: Resources for machine learning in Ruby,,111,1575,135,4,2021-02-05T03:10:26Z,2020-11-16T10:03:56Z
macos-apps,https://github.com/learn-anything/macos-apps,learn-anything,Awesome macOS apps,,25,552,31,0,2021-02-08T23:00:23Z,2020-06-24T00:42:56Z
magictools,https://github.com/ellisonleao/magictools,ellisonleao,:video_game: :pencil: A list of Game Development resources to make magic happen.,,425,7925,756,2,2021-02-10T16:07:41Z,2021-01-28T18:13:27Z
maintenance-modules,https://github.com/maxogden/maintenance-modules,maxogden,a list of modules that are useful for maintaining or developing modules,,24,338,18,3,2021-01-06T21:58:37Z,2016-05-19T16:35:25Z
manong,https://github.com/nemoTyrant/manong,nemoTyrant,码农周刊整理,,533,3832,983,0,2021-02-09T03:31:38Z,2017-09-25T10:56:48Z
markdown-resources,https://github.com/rhythmus/markdown-resources,rhythmus,"A curated collection of Markdown resources: apps, dialects, parsers, people, …",,11,153,17,3,2020-09-19T08:17:24Z,2019-11-18T21:37:24Z
Marketing-for-Engineers,https://github.com/goabstract/Marketing-for-Engineers,goabstract,A curated collection of marketing articles & tools to grow your product. ,,391,11454,786,20,2021-02-10T09:30:33Z,2020-10-27T20:51:02Z
mind-bicycles,https://github.com/pel-daniel/mind-bicycles,pel-daniel,List of future of programming projects,,25,222,4,7,2021-02-10T13:58:51Z,2020-12-13T18:35:50Z
motion-ui-design,https://github.com/fliptheweb/motion-ui-design,fliptheweb,"Resources for inspiration, lists of software, libraries and other stuff related to Motion UI design, animations and transitions.",,35,664,68,1,2021-01-26T14:44:06Z,2021-01-03T21:18:54Z
movies-for-hackers,https://github.com/k4m4/movies-for-hackers,k4m4,🎬 A curated list of movies every hacker & cyberpunk must watch.,https://hackermovie.club/,369,8565,816,123,2021-02-10T23:32:33Z,2020-12-02T14:39:56Z
must-watch-css,https://github.com/AllThingsSmitty/must-watch-css,AllThingsSmitty,A useful list of must-watch talks about CSS,,355,3909,231,0,2021-02-08T15:37:53Z,2020-12-31T19:19:19Z
must-watch-javascript,https://github.com/AllThingsSmitty/must-watch-javascript,AllThingsSmitty,A useful list of must-watch talks about JavaScript,,371,6264,303,3,2021-02-10T17:44:35Z,2020-12-31T19:19:13Z
my_tech_resources,https://github.com/JamesLavin/my_tech_resources,JamesLavin,List of tech resources future me and other Javascript/Ruby/Python/Elixir/Elm developers might find useful,,27,226,95,1,2021-02-09T05:29:58Z,2021-01-18T22:34:01Z
resources,https://github.com/nashville-lispers/resources,nashville-lispers,"Lisp Resources: exercises, great books, videos, etc.",,2,3,0,0,2016-04-27T18:07:58Z,2015-01-18T11:48:59Z
net-libraries-that-make-your-life-easier,https://github.com/tallesl/net-libraries-that-make-your-life-easier,tallesl,Open Source .NET libraries that make your life easier.,,74,599,104,1,2021-02-10T16:23:15Z,2021-01-01T14:46:13Z
neural-network-papers,https://github.com/robertsdionne/neural-network-papers,robertsdionne,,,189,1809,372,1,2021-02-08T04:29:43Z,2020-07-19T08:17:52Z
nginx-resources,https://github.com/fcambus/nginx-resources,fcambus,"A collection of resources covering Nginx, Nginx + Lua, OpenResty and Tengine",http://www.cambus.net,167,2809,289,1,2021-02-09T18:27:46Z,2020-12-07T21:17:36Z
nlp_thai_resources,https://github.com/kobkrit/nlp_thai_resources,kobkrit,More than 50+ collections of Thai Natural Language Processing libraries. Update daily.,,40,294,64,5,2021-02-07T04:20:39Z,2021-01-08T09:46:47Z
nlp-with-ruby,https://github.com/arbox/nlp-with-ruby,arbox,Curated List: Practical Natural Language Processing done in Ruby,http://rubynlp.org,53,906,52,5,2021-02-02T21:00:54Z,2020-12-16T13:36:41Z
node-daily,https://github.com/dailyNode/node-daily,dailyNode,daily article for node,,53,319,46,0,2020-12-10T02:52:19Z,2015-11-24T05:38:30Z
node-frameworks,https://github.com/pillarjs/node-frameworks,pillarjs,A comparison of server-side node frameworks,,19,313,15,4,2021-01-18T21:33:31Z,2017-12-07T13:01:49Z
nodejs-conference-cfps,https://github.com/rosskukulinski/nodejs-conference-cfps,rosskukulinski,Curated list of upcoming conference CFPs,,1,0,0,0,2014-08-05T06:07:43Z,2014-08-27T17:12:25Z
NodeJS-Learning,https://github.com/sergtitov/NodeJS-Learning,sergtitov,"This page contains collection of curated links to blog posts, articles, videos, tutorials, books, frameworks, modules, IDEs, testing tools, hosting providers, etc. to help you learn Node.js and keep up to date.",,100,1605,340,4,2021-02-09T14:50:07Z,2020-10-25T03:14:35Z
NotesIndex,https://github.com/Wilbeibi/NotesIndex,wilbeibi,A collection of my technical notes,,20,159,31,0,2020-12-26T02:47:39Z,2018-08-16T07:10:58Z
not-yet-awesome-rust,https://github.com/not-yet-awesome-rust/not-yet-awesome-rust,not-yet-awesome-rust,"A curated list of Rust code and resources that do NOT exist yet, but would be beneficial to the Rust community.",,67,772,26,26,2021-02-10T22:38:14Z,2020-12-05T19:28:07Z
offline-first,https://github.com/pazguille/offline-first,pazguille,:electric_plug: Everything you need to know to create offline-first web apps.,,139,2704,188,2,2021-02-05T22:49:08Z,2018-10-24T06:30:42Z
open-source-android-apps,https://github.com/pcqpcq/open-source-android-apps,pcqpcq,Open-Source Android Apps,,679,8370,2150,72,2021-02-10T18:00:14Z,2021-02-09T13:04:38Z
open-source-ios-apps,https://github.com/dkhamsing/open-source-ios-apps,dkhamsing,:iphone: Collaborative List of Open-Source iOS Apps,https://open-source-ios-apps.netlify.app,1413,26404,4244,0,2021-02-10T23:40:13Z,2021-02-09T14:27:13Z
open-source-mac-os-apps,https://github.com/serhii-londar/open-source-mac-os-apps,serhii-londar,🚀 Awesome list of open source applications for macOS. https://t.me/opensourcemacosapps,,891,24520,1643,33,2021-02-10T23:03:03Z,2021-02-09T17:18:18Z
open-source-meetup-alternatives,https://github.com/coderbyheart/open-source-meetup-alternatives,coderbyheart,Open-Source Alternatives to Meetup,,13,190,18,1,2021-01-17T11:25:44Z,2020-11-27T14:58:13Z
ops-books,https://github.com/stack72/ops-books,stack72,Book Recommendations for the Infrastructure Engineer ;),,62,821,106,7,2021-02-04T14:20:20Z,2018-06-12T15:21:47Z
osx-and-ios-security-awesome,https://github.com/ashishb/osx-and-ios-security-awesome,ashishb,OSX and iOS related security tools,,60,752,143,2,2021-02-10T01:21:17Z,2020-09-02T05:57:53Z
papers,https://github.com/NicolasT/papers,NicolasT,A collection of papers found across the web,,3,31,10,0,2020-12-04T01:55:42Z,2015-09-13T11:15:35Z
papers-we-love,https://github.com/papers-we-love/papers-we-love,papers-we-love,Papers from the computer science community to read and discuss.,http://paperswelove.org/,2897,44501,3935,14,2021-02-10T23:16:46Z,2021-02-05T06:17:54Z
ParseAlternatives,https://github.com/relatedcode/ParseAlternatives,relatedcode,A collaborative list of Parse alternative backend service providers.,https://relatedcode.com,145,2796,297,2,2021-02-04T00:34:07Z,2021-01-09T12:37:16Z
pattern_classification,https://github.com/rasbt/pattern_classification,rasbt,A collection of tutorials and examples for solving and understanding machine learning and pattern classification tasks,,398,3756,1257,1,2021-02-10T01:10:21Z,2020-10-19T18:00:47Z
PayloadsAllTheThings,https://github.com/swisskyrepo/PayloadsAllTheThings,swisskyrepo,A list of useful payloads and bypass for Web Application Security and Pentest/CTF,,1223,21561,6433,10,2021-02-10T23:56:35Z,2021-02-10T15:36:19Z
personal-security-checklist,https://github.com/Lissy93/personal-security-checklist,Lissy93,🔒 A curated checklist of 300+ tips for protecting digital security and privacy in 2021,https://security-list.js.org,76,1605,148,7,2021-02-10T09:23:42Z,2021-02-07T23:15:45Z
php-must-watch,https://github.com/phptodayorg/php-must-watch,phptodayorg,list of interesting conference talks and videos on PHP - ,https://www.phptoday.org/,314,2587,224,2,2021-02-04T13:07:07Z,2018-10-18T18:17:58Z
bookmarks,https://github.com/phpvietnam/bookmarks,phpvietnam,Resources for Vietnamese PHP Developers,,2,0,1,0,2014-11-09T09:55:31Z,2014-11-13T03:10:17Z
PlacesToPostYourStartup,https://github.com/mmccaff/PlacesToPostYourStartup,mmccaff,"Compiled list of links from ""Ask HN: Where can I post my startup to get beta users?""",,169,4310,383,6,2021-02-10T18:45:14Z,2021-01-19T18:54:57Z
conferences,https://github.com/planetruby/calendar,planetruby,What's Upcoming in 2021? - A collection of awesome ruby conferences & camps from around the world - Add your ruby conference or camp!,https://planetruby.github.io/conferences,38,245,74,0,2021-02-06T21:13:53Z,2021-02-06T21:13:50Z
post-mortems,https://github.com/danluu/post-mortems,danluu,A collection of postmortems. Sorry for the delay in merging PRs!,http://danluu.com/postmortem-lessons/,511,7957,298,8,2021-02-10T20:27:44Z,2021-02-02T14:17:04Z
programmers-proverbs,https://github.com/AntJanus/programmers-proverbs,AntJanus,Proverbs from the programmer,,57,642,74,9,2021-01-13T19:41:43Z,2020-02-24T07:50:52Z
programming-talks,https://github.com/hellerve/programming-talks,hellerve,Awesome & interesting talks about programming,,309,5527,397,2,2021-02-08T23:14:51Z,2021-01-30T10:58:47Z
progressive-enhancement-resources,https://github.com/jbmoelker/progressive-enhancement-resources,jbmoelker,Resources on Progressive Enhancement. From concept and strategies to feature detection & testing methods. Complete with a list of (code) examples.,,9,75,5,0,2020-12-30T14:47:23Z,2020-08-12T08:02:14Z
project-based-learning,https://github.com/tuvtran/project-based-learning,tuvtran,Curated list of project-based tutorials,,1810,43823,7011,97,2021-02-10T23:23:44Z,2021-02-01T18:42:58Z
Projects,https://github.com/karan/Projects,karan,:page_with_curl: A list of practical projects that anyone can solve in any programming language.,https://twitter.com/karangoel,1973,33731,9823,68,2021-02-10T19:35:32Z,2021-02-09T09:57:10Z
public-apis,https://github.com/public-apis/public-apis,public-apis,A collective list of free APIs for use in software and web development.,https://ultimatecourses.com,3121,109967,13551,250,2021-02-10T23:38:49Z,2021-02-10T21:26:06Z
purescript-companies,https://github.com/ajnsit/purescript-companies,ajnsit,Community curated list of companies that use Purescript,,19,112,23,0,2021-02-08T14:19:04Z,2021-02-08T14:19:01Z
pycrumbs,https://github.com/kirang89/pycrumbs,kirang89,Bits and bytes of Python from the Internet,,287,3011,686,3,2021-01-31T01:28:17Z,2020-11-18T11:22:56Z
py-must-watch,https://github.com/s16h/py-must-watch,s16h,Must-watch videos about Python,http://pymust.watch/,277,3326,285,25,2021-02-10T05:27:52Z,2020-11-28T16:15:27Z
python-github-projects,https://github.com/checkcheckzz/python-github-projects,checkcheckzz,Collect and classify python projects on Github (deprecated),http://itgeekworkhard.com/python-github-projects/,99,690,213,5,2021-02-06T13:43:18Z,2020-12-07T16:11:11Z
pythonidae,https://github.com/svaksha/pythonidae,svaksha,Curated decibans of scientific programming resources in Python.,http://svaksha.github.io/pythonidae,74,769,177,5,2021-01-24T22:12:34Z,2020-11-27T15:58:40Z
python-must-watch,https://github.com/primalpop/python-must-watch,primalpop,Must-watch videos about Python,,2,14,1,0,2020-10-10T23:17:48Z,2014-07-18T14:54:39Z
python_reference,https://github.com/rasbt/python_reference,rasbt,"Useful functions, tutorials, and other Python-related things",,219,2819,765,8,2021-02-10T14:21:35Z,2020-10-01T06:21:19Z
Qix,https://github.com/ty4z2008/Qix,ty4z2008,Machine Learning、Deep Learning、PostgreSQL、Distributed System、Node.Js、Golang,http://ty4z2008.github.io/Qix,1862,13476,4719,0,2021-02-10T15:27:18Z,2020-11-21T14:15:45Z
queues.io,https://github.com/lukaszx0/queues.io,lukaszx0,"Queues, all of them.",http://queues.io,67,1309,184,33,2021-02-06T02:55:32Z,2020-02-05T19:48:00Z
quick-look-plugins,https://github.com/sindresorhus/quick-look-plugins,sindresorhus,List of useful Quick Look plugins for developers,,461,15645,512,7,2021-02-10T20:41:59Z,2021-01-24T06:08:51Z
rails-must-watch,https://github.com/gerricchaplin/rails-must-watch,gerricchaplin,,,2,13,1,0,2016-11-20T17:11:40Z,2014-12-28T22:23:22Z
rbooks,https://github.com/RomanTsegelskyi/rbooks,RomanTsegelskyi,A curated list of #rstats books,,17,156,30,3,2021-01-30T13:26:16Z,2017-11-02T09:19:37Z
remote-in-japan,https://github.com/remote-jp/remote-in-japan,remote-jp,Tech companies in Japan that hire remote workers,https://remotework.jp,94,1043,173,2,2021-02-10T04:33:45Z,2021-02-10T04:50:19Z
remote-jobs,https://github.com/remoteintech/remote-jobs,remoteintech,A list of semi to fully remote-friendly companies in tech.,https://remoteintech.company/,825,16221,1631,29,2021-02-10T17:16:49Z,2021-02-10T06:31:46Z
remote-jobs-brazil,https://github.com/lerrua/remote-jobs-brazil,lerrua,Lista de empresas com trabalho remoto no Brasil,,513,3604,428,13,2021-02-10T00:32:42Z,2021-01-28T00:50:07Z
resource-list,https://github.com/kyasui/resource-list,kyasui,A list of design and development resources,,2,14,4,1,2020-06-21T04:33:15Z,2017-02-22T19:58:49Z
resources,https://github.com/jbranchaud/resources,jbranchaud,"a collection of free, online resources for various technologies, languages, and tools",,4,41,3,4,2020-12-04T01:58:03Z,2016-05-15T22:55:43Z
Resources,https://github.com/tevko/Resources,tevko,A collection of the latest and most useful resources for full stack web development,,42,404,54,0,2021-02-08T00:36:24Z,2021-02-08T00:36:21Z
Resources-for-Beginner-Bug-Bounty-Hunters,https://github.com/nahamsec/Resources-for-Beginner-Bug-Bounty-Hunters,nahamsec,A list of resources for those interested in getting started in bug bounties,,426,5669,1004,16,2021-02-10T18:46:20Z,2021-01-21T04:13:13Z
Resources-for-Writing-Shaders-in-Unity,https://github.com/VoxelBoy/Resources-for-Writing-Shaders-in-Unity,VoxelBoy,For the UNITE Boston 2015 talk titled Writing Shaders: YOU can do it!,,22,178,29,0,2021-01-08T00:24:06Z,2017-08-30T16:55:43Z
retter,https://github.com/MaciejCzyzewski/retter,maciejczyzewski,"A collection of hash functions, ciphers, tools, libraries, and materials related to cryptography & security. :closed_lock_with_key::closed_lock_with_key::closed_lock_with_key::closed_lock_with_key::closed_lock_with_key: (project was renamed, libchaos is main)",https://maciejczyzewski.github.io/retter/,5,54,20,1,2021-01-19T02:05:16Z,2017-03-06T20:43:46Z
reverse-interview,https://github.com/viraptor/reverse-interview,viraptor,Questions to ask the company during your interview,,287,16329,1259,20,2021-02-10T18:09:38Z,2020-10-30T05:38:50Z
Rich-Hickey-fanclub,https://github.com/tallesl/Rich-Hickey-fanclub,tallesl,"""every time I watch one of his talks I feel like someone has gone in and organized my brain""",,283,2636,89,0,2021-02-10T22:27:07Z,2020-07-20T00:10:47Z
rss-readers-list,https://github.com/smithbr/rss-readers-list,smithbr,📚 Reader replacements megalist,,5,23,10,0,2020-07-23T03:05:14Z,2017-08-11T07:48:33Z
rubybib.org,https://github.com/rubybib/rubybib.org,rubybib,The Ruby Bibliography,http://rubybib.org/,11,102,16,2,2021-01-11T15:59:56Z,2021-01-11T15:59:54Z
ruby-bookmarks,https://github.com/dreikanter/ruby-bookmarks,dreikanter,Ruby and Ruby on Rails bookmarks collection,,130,1895,314,2,2021-02-10T18:43:07Z,2020-10-23T08:34:36Z
ruby-dev-bookmarks,https://github.com/saberma/ruby-dev-bookmarks,saberma,A list of ruby development resources I've collected. Pull requests are welcome.,,58,415,89,0,2020-12-16T21:13:43Z,2014-09-02T04:01:26Z
ruby-nlp,https://github.com/diasks2/ruby-nlp,diasks2,"A collection of links to Ruby Natural Language Processing (NLP) libraries, tools and software",,81,1194,97,2,2021-02-02T21:00:37Z,2018-12-20T21:28:35Z
rust-lang-resources,https://github.com/dschenkelman/rust-lang-resources,dschenkelman,Rust lang resources -  A collection of links related to the rust programming language,,1,3,0,0,2019-07-18T23:19:16Z,2014-10-13T17:11:03Z
rxjs-ecosystem,https://github.com/Widdershin/rxjs-ecosystem,Widdershin,What are the most popular libraries in the RxJS ecosystem?,,3,62,3,0,2021-02-10T12:01:01Z,2021-02-10T12:00:58Z
rx-react-flux,https://github.com/christianramsey/rx-react-flux,christianramsey,A list of rxjs + react/flux implementations,,1,13,1,0,2019-01-14T11:31:35Z,2015-07-31T12:30:45Z
scalable-css-reading-list,https://github.com/davidtheclark/scalable-css-reading-list,davidtheclark,Collected dispatches from The Quest for Scalable CSS,,101,1372,79,3,2021-02-10T09:45:33Z,2020-10-14T15:51:23Z
search-engine-optimization,https://github.com/marcobiedermann/search-engine-optimization,marcobiedermann,:mag: A helpful checklist/collection of Search Engine Optimization (SEO) tips and techniques.,,77,1613,266,8,2021-02-10T19:10:05Z,2021-02-03T10:59:08Z
SecLists,https://github.com/danielmiessler/SecLists,danielmiessler,"SecLists is the security tester's companion. It's a collection of multiple types of lists used during security assessments, collected in one place. List types include usernames, passwords, URLs, sensitive data patterns, fuzzing payloads, web shells, and many more.",https://www.owasp.org/index.php/OWASP_Internet_of_Things_Project,1768,29826,15091,41,2021-02-10T22:48:01Z,2021-02-04T07:13:19Z
secure-email,https://github.com/OpenTechFund/secure-email,OpenTechFund,Overview of projects working on next-generation secure email.,,78,444,65,12,2021-02-07T05:39:48Z,2018-04-12T00:35:27Z
Security_list,https://github.com/zbetcheckin/Security_list,zbetcheckin,Great security list for fun and profit,,112,1325,322,4,2021-02-10T09:20:35Z,2020-09-01T21:24:26Z
services-engineering,https://github.com/mmcgrana/services-engineering,mmcgrana,"A reading list for services engineering, with a focus on cloud infrastructure services",,213,3103,264,52,2021-02-09T18:55:41Z,2020-05-09T06:18:46Z
shellshocker-pocs,https://github.com/mubix/shellshocker-pocs,mubix,Collection of Proof of Concepts and Potential Targets for #ShellShocker,,115,840,198,2,2021-02-03T23:40:42Z,2020-05-16T12:26:23Z
slack-groups,https://github.com/learn-anything/slack-groups,learn-anything,Awesome Slack Groups,,1,20,4,0,2021-01-29T02:08:51Z,2020-06-24T00:32:26Z
spark-joy,https://github.com/sw-yx/spark-joy,sw-yx,"✨😂easy ways to add design flair, user delight, and whimsy to your product.",,87,4802,171,7,2021-02-10T21:24:04Z,2021-02-10T21:24:02Z
spawnedshelter,https://github.com/unbalancedparentheses/spawnedshelter,unbalancedparentheses,":blue_book: Erlang Spawned Shelter. Erlang and Elixir training with the best articles, videos, books and talks🎓",https://spawnedshelter.com/,41,326,46,6,2021-02-01T12:36:21Z,2019-10-23T23:22:01Z
speech-language-processing,https://github.com/edobashira/speech-language-processing,edobashira,A curated list of speech and natural language processing resources,,145,2003,283,20,2021-02-08T10:26:13Z,2019-04-02T12:35:13Z
stack-on-a-budget,https://github.com/255kb/stack-on-a-budget,255kb,"A collection of services with great free tiers for developers on a budget. Sponsored by Mockoon, the best mock API tool. https://mockoon.com",,239,8022,360,2,2021-02-10T12:07:42Z,2021-02-02T14:18:15Z
startup-must-watch,https://github.com/gerricchaplin/startup-must-watch,gerricchaplin,,,3,32,5,0,2020-12-04T01:58:15Z,2014-10-12T12:26:32Z
startupreadings,https://github.com/dennybritz/startupreadings,dennybritz,Reading list for all things startup-related,,36,380,82,1,2021-02-09T19:42:07Z,2018-11-14T15:14:18Z
Startup-Resources,https://github.com/JonathanZWhite/startup-resources,JonathanZWhite,Curated list of startup resources,,2,26,7,1,2020-12-04T01:58:19Z,2017-11-03T15:26:11Z
state-machines,https://github.com/achou11/state-machines,achou11,A humble repo to collect knowledge on state machines.,,3,41,2,0,2021-01-18T21:34:06Z,2019-11-22T05:45:48Z
static-analysis,https://github.com/analysis-tools-dev/static-analysis,analysis-tools-dev,"A curated list of static analysis (SAST) tools for all programming languages, config files, build tools, and more.",https://analysis-tools.dev,318,8215,960,2,2021-02-10T18:36:11Z,2021-02-08T12:18:13Z
Static-Site-Generators,https://github.com/pinceladasdaweb/Static-Site-Generators,pinceladasdaweb,A definitive list of tools for generating static websites.,,29,550,101,0,2021-01-29T15:10:21Z,2021-01-28T16:21:17Z
staticsitegenerators-list,https://github.com/bevry/staticsitegenerators-list,bevry,"A comprehensive, partially automatically generated comparison of static site generators",https://staticsitegenerators.net,11,191,193,9,2021-01-26T20:24:16Z,2021-01-26T20:24:12Z
streaming-papers,https://github.com/sorenmacbeth/streaming-papers,sorenmacbeth,A curated collection of papers on streaming algorithms,,27,188,32,0,2020-08-28T03:57:01Z,2018-07-27T02:16:25Z
structured-text-tools,https://github.com/dbohdan/structured-text-tools,dbohdan,A list of command line tools for manipulating structured text data,,167,5626,202,5,2021-02-09T17:51:35Z,2021-01-07T10:26:28Z
styleguide-generators,https://github.com/davidhund/styleguide-generators,davidhund,An overview of automatic living styleguide generators,,62,1887,117,6,2021-01-28T19:44:08Z,2019-05-31T17:00:33Z
sublime,https://github.com/JaredCubilla/sublime,JaredCubilla,"A collection of some of the best Sublime Text packages, themes, and goodies.",,75,1027,144,7,2021-02-10T05:35:38Z,2020-11-01T13:55:39Z
sublime-bookmarks,https://github.com/dreikanter/sublime-bookmarks,dreikanter,Sublime Text essential plugins and resources,,50,872,67,0,2021-02-08T22:55:48Z,2020-05-17T11:06:28Z
integrations,https://github.com/sveltejs/integrations,sveltejs,Ways to incorporate Svelte into your stack,https://svelte.dev,34,471,33,2,2021-02-08T09:10:37Z,2021-01-09T21:34:47Z
SwiftInFlux,https://github.com/ksm/SwiftInFlux,ksm,An attempt to gather all that is in flux in Swift.,,233,1890,84,0,2021-02-08T18:50:45Z,2015-12-03T22:21:59Z
tech-weekly,https://github.com/adrianmoisey/tech-weekly,adrianmoisey,,,2,13,2,0,2020-12-30T23:59:53Z,2019-11-18T15:50:23Z
terminals-are-sexy,https://github.com/k4m4/terminals-are-sexy,k4m4,"💥 A curated list of Terminal frameworks, plugins & resources for CLI lovers.",https://terminalsare.sexy/,314,9715,536,83,2021-02-10T21:11:55Z,2021-02-08T22:24:48Z
the-book-of-secret-knowledge,https://github.com/trimstray/the-book-of-secret-knowledge,trimstray,"A collection of inspiring lists, manuals, cheatsheets, blogs, hacks, one-liners, cli/web tools and more.",,1332,35982,3881,7,2021-02-10T23:38:25Z,2021-01-26T15:14:40Z
The-Documentation-Compendium,https://github.com/kylelobo/The-Documentation-Compendium,kylelobo,📢 Various README templates & tips on writing high-quality documentation that people want to read.,,85,4030,389,18,2021-02-10T16:38:27Z,2020-09-07T21:14:45Z
think-awesome,https://github.com/thinkjs/think-awesome,thinkjs,A curated list of awesome things related to ThinkJS 3.x,https://thinkjs.org,29,313,63,0,2021-02-02T08:33:51Z,2020-04-23T08:48:09Z
til,https://github.com/jbranchaud/til,jbranchaud,:memo: Today I Learned,,459,9423,551,10,2021-02-10T17:35:24Z,2021-02-10T17:35:19Z
tips,https://github.com/git-tips/tips,git-tips,Most commonly used git tips and tricks.,http://git.io/git-tips,569,16969,1536,23,2021-02-10T21:40:21Z,2021-01-12T20:18:33Z
Toolbox,https://github.com/Dillion/Toolbox,Dillion,Catalog of modern iOS tools,,2,13,1,0,2017-03-11T17:52:08Z,2015-05-31T13:30:01Z
tool_lists,https://github.com/johnyf/tool_lists,johnyf,Links to tools by subject,,45,269,63,0,2021-02-10T16:28:21Z,2020-12-18T07:50:38Z
